username,date,rating,review,likes,dislikes
alaw****,2014.02.20. 21:50,9,보통은 영화끝날때쯤 오줌마려워서 빨리 화장실 가는데..이 영화는 엔딩크래팃까지 보다가 나왔네요. 화면이 따듯한 영화.,21,2
moro****,2014.02.20. 16:36,10,코엑스에서 보고왔어요.. 나도 저렇게 와이프 사랑하면서 늙어야지..감동감동 정말 따뜻한 영화네요~!  잘 봤습니다.,15,1
cyxl****,2014.02.21. 16:07,9,결혼할 사람 혹은 배우자와 함께보면 좋을 영화,11,0
ddal****,2014.08.16. 01:40,8,세월의 흐름 앞에서도 저렇게 사랑할 수만 있다면... 따뜻한 영화.,10,0
ksd8****,2014.02.20. 08:59,10,마음한편이 찡해오는 영화 추천합니다,10,0
ilov****,2015.02.05. 13:48,10,캐나다의 건축법이 참으로 까다롭다. 미국도 마찬가지고 순전히 업자들 이윤보장에 맞추어져 있는 듯..,9,0
kjs0****,2014.02.21. 14:19,10,너무감동이었습니다.,9,0
mpgo****,2017.02.19. 07:09,10,야간 편의점 알바를 하면서 봤는데 눈물이 펑펑 나서100분짜리가 160분이 된 영화 뒤바뀐 밤낮에 적응 못하고 의미없다고 생각한 하루를 채워준 영화 죽음이라는 것을 생각하고 고민하게 해주는 영화 나에겐 너무 벅찬 영화,10,1
milk****,2016.06.23. 11:59,8,해피엔딩이라 좋았고 후반부에 나오는 음악이 너무 좋았다. 미국 시골 풍경의 여유와 풍요로움이 느껴 졌던 영화,7,0
aper****,2015.03.01. 00:22,10,많은 생각을 하게 만드는진한 여운이 남는 영화,7,0
bboi****,2017.02.27. 22:20,9,삶과 죽음사이에서 정말 사랑하는 사람들에 대한 이야기.,3,0
jdud****,2015.03.15. 00:30,10,61년을 같이 보내는건 어떤 기분일까,3,0
mool****,2014.11.15. 05:44,9,"따뜻한 영화..,,.",3,0
drum****,2014.10.12. 23:21,9,따뜻한 영화...잘 봤어요..,3,0
dfwi****,2016.11.28. 00:58,10,"소도안되고, 딸기도안되고  그리고 새집까지..  그래도 그녈위해 끝끝내 해내는..  잔잔하지만 뜨거웠다.",2,0
ulsc****,2014.06.20. 00:15,10,한마디로 표현할영화가 아니에요사랑이라는 단어에 세월흔적기억 많은것들이 포함된다는걸 깨닫는 시간이였습니다  저리 늙어갈수있단건 인생최고의행운이란것을..최고의영화 !,2,0
fiel****,2014.04.26. 09:41,7,잔잔한 바다 위의 부표처럼... 평화과 평안.,2,0
tnfu****,2014.04.17. 21:25,9,이렇게 늙어 함께 하고 싶다 부부 친구,2,0
phss****,2014.04.04. 18:45,8,"늙은 친구를 떠나 보내는, 미안한 친구의 슬픈 눈물.. 여보! 당신이 있어 고맙소...",2,0
egyp****,2014.04.04. 13:23,7,오직 아내만을 위한 열정 가득한 감동적인 대형 프로젝트...위태롭지만 뚝심있게 새로운 집 짓기에 계속 몰두하던 쥔공 크레이그...정말 내 땅에 집 짓는데 허가받고 승인받을 것들이 그리 많은지...참견하지 말라고 체스터에게 버럭 화냈었던...,2,0
anda****,2017.03.12. 02:05,9,집짓기를 통한 사랑의 완성. 아름다운 화면은 덤.,3,1
pin_****,2016.09.13. 10:32,9,감동실화 황혼로맨스.중증치매상태의 아내를위해 자신이 소유한땅가운데 가장아름다운장소에 예쁜집을 직접지어 얼마남지않은아내에게 선물하려는 그의마음씨에 콧날이시큰거렸다.그나저나 캐나다건축법 엄청 빡빡하다.전문건축가나 기업아니면 개인은 손도대지말라는거지저게뭐냐,3,1
ever****,2016.05.10. 23:20,10,신혼부부인데 이 영활 봤어요. 이렇게 서로 계속 사랑하고 아끼며 힘들때나 기쁠때나 곁에서 서로 의지하며 살고 싶네요 :) 무공해 영화 화면도 음악도 대사도 연기도 완벽합니다.,3,1
jesu****,2014.04.19. 13:43,9,독고다이 할아버지의 자존감 철학을 배운다,1,0
5569****,2014.02.21. 17:32,10,노년인구가 늘어만 가는데 요즘같이 대부분 노인요양소에 보내지는데 이런 남편이 있다면  성공한 결혼,1,0
yh_c****,2014.02.21. 16:54,9,가까운 미래에 내 모습을 다시한번 그려보며 계획하게 되는 영화..,1,0
wwwf****,2014.02.21. 16:26,9,마음이 따뜻해지는 영화였습니다.,1,0
sim1****,2014.02.21. 16:18,9,이영화 완전 감동적이에요ㅠ,1,0
tr19****,2014.02.21. 16:11,10,"가족,우정,부부의 모든 사랑을 잔잔히 눈물로 흐르게 합니다보면서 내내 나도 모르는 눈물이.. 이걸 감동이상이 젖어드는 영화",1,0
nana****,2014.02.21. 09:36,10,이렇게 진하면서도 아름다운 영화는 처음이였어요. 화면도 내용도.. 부모님께 보여드려야겠어요!!!,1,0
pass****,2016.10.17. 18:33,7,일단 많은 땅고 자기 집이 있으니까 할 수 있는 고민들였네,2,1
tear****,2014.11.20. 07:04,7,삶을 정리하는 노부부의 로맨스와 드라마.,2,1
ykdi****,2014.07.19. 20:31,8,늙는다는 것이 추한 것 만은 아니다.,2,1
okny****,2024.10.17. 20:01,8,나이들어 감에 시대에 적음못하는 노인의 똥고집을 잘연출한 영화다 갚은공감과 아픔을 느끼는 영화다,0,0
spig****,2024.09.18. 19:03,10,"공감이 가는, 가슴이 뭉클해지는 영화입니다.",0,0
marc****,2022.09.14. 23:57,7,마지막까지 함께 하는,0,0
sept****,2022.09.08. 17:58,9,나이 87에 새로운 목표가 생겼다!법이 계속 방해하지만..세상에서 단 하나뿐인 사랑하는 사람을 위한    나 홀로 집 만들기 프로젝트,0,0
somm****,2022.04.23. 15:36,8,"느리고 쓸쓸하며, 해피엔딩이지만 여전히 슬픈 영화.",0,0
smn1****,2022.01.05. 14:53,10,감동적인 연기와 스토리,0,0
cont****,2021.06.21. 14:15,9,"연기, 연출, 호흡 모두 너무나 원숙하다. 노년을 대처하는 슬기로운 자세를 배우다.",0,0
dudm****,2019.12.14. 22:04,10,. ~ ~ .,0,0
skfo****,2014.05.06. 19:08,9,"누군가 나에게, 내가 누군가에게 또.",0,0
whtn****,2014.03.06. 19:59,10,내미래에 남편이나 아내가 저렇게 해줄수 있을까??,0,0
534k****,2014.03.02. 00:17,10,가끔 이런 영화보는 것도 좋지,0,0
happ****,2014.02.21. 16:21,10,영화  마지막  음악이 흐르면서  나오는  장면은  정말 가슴을 찡~하게 만들었어요~오랫만에 힐링되는 영화를  봤네요..정말 강추!! 입니다~,0,0
blki****,2014.02.21. 16:20,10,사랑의 진심을 믿지 않는 현대인에게 귀감이 될만한 영화네요...함께 늙어가며 여전히 사랑하여 세상의 편견과 용감히 싸우는 사람들이 많고 우리도 그럴수 있다는걸 믿고 싶어지는 영화입니다,0,0
sora****,2014.02.21. 16:10,10,마음이 따뜻해 지는 영화네요~ 저도 이렇게 아름답고 행복하게 나이들고 싶습니다~,0,0
yjer****,2014.02.21. 16:03,10,사람의 마음을 움직이는 가슴 따뜻한 작품!,0,0
fuen****,2014.02.21. 15:59,10,기대 많이 되는 영화! 감동 그 자체!,0,0
lemo****,2014.02.21. 14:36,10,또 보고싶은 영화네요♥,0,0
wind****,2014.02.21. 11:12,10,행복한 슬픔. 인생의 깊이.,0,0
kito****,2014.07.17. 02:32,9,전혀 슬프지 않은 영화인데 눈물난다.,1,1
leey****,2019.06.25. 09:24,10,아내를 향한 마지막 사랑의 표현인 줄은 알겠지만 그 고집스러움이 결국 상황을 어렵게 만들고....평생 함께한 지고지순한 사랑에 가슴 따뜻한 영화~^^,0,1
ssha****,2018.07.19. 23:12,9,이 할머니가   '천일의 앤(1969)'의 앤 이였어?,0,1
law_****,2017.03.19. 22:57,10,할아버지 배우 존잘 존멋 ㅠ,0,1
lonr****,2015.03.13. 15:42,7,Com-처음부터 끝까지.. 할아버지 할머니의 영화... 치매를 앓던.. 아내를.. 지극정성으로 돌보는 맥가이버 할아버지.. 결국 세상의 규범과 질서에 갈등을 빚고.. 꽤나.. 여러영화에 낯이 익은 할아버지.. 말년에 주연까지.. 축하해요~,0,1
thev****,2015.02.25. 09:43,1,"숨어있는 보석... 영화보기란 이런 숨어있는 보석을 찾는 여정... 일상의 언어를 아름다운 시어로 승화시켰고, 단 한 순간도 눈을 떼지 못했다...,! 일본 감독들에게 모범적인 해답을 보여주는 텍스트, 고문과 수면제가 아닌 잔잔함이란 이런 것...",1,2
sury****,2015.03.01. 14:00,1,따뜻한 영화지만 평범하다.,0,4
tn99****,2014.11.16. 18:24,7,솔직히 새집 불편할거 같은데? ㅋㅋ,1,6
daum****,2014.02.21. 17:41,1,내가 보기에는 별로라는 생각이든다,0,8
hyon****,2014.02.20. 08:22,5,굿 내가처음이다귯굿굿굿,0,10
