date,title,url,content,summary
20240708,"원/달러 환율, 미국 고용지표 둔화에 1,370원대 하락 출발",https://n.news.naver.com/mnews/article/001/0014792467,"8일 원/달러 환율이 지난 5일 발표된 미국 고용지표를 소화하며 하락 출발했다.이날 서울 외환시장에서 미국 달러화 대비 원화 환율은 오전 9시 12분 현재 전 거래일보다 2.2원 내린 1,378.1원에 거래되고 있다.환율은 전 거래일보다 4.2원 내린 1,376.1원에 개장해 1,370원대 후반에서 움직이고 있다.미국의 6월 비농업 고용은 20만6천명 증가하면서 시장 예상치를 소폭 상회했지만, 지난 4∼5월 수치가 각각 5만4천명, 5만7천명 하향 조정됐다. 6월 실업률은 4.1%로 예상치이자 전월치인 4.0%를 상회했다.이런 고용시장 냉각 신호에 따라 미국 연방준비제도의 9월 금리 인하 기대가 커졌다.같은 시각 원/엔 재정환율은 100엔당 858.13원에 거래되고 있다.","8일 원/달러 환율이 지난 5일 발표된 미국 고용지표를 소화하며 하락 출발했다.이날 서울 외환시장에서 미국 달러화 대비 원화 환율은 오전 9시 12분 현재 전 거래일보다 2.2원 내린 1,378.1원에 거래되고 있다."
20240709,"원/달러 환율, 파월 발언 앞두고 관망…1,380원대 초반 소폭상승",https://n.news.naver.com/mnews/article/001/0014796032,"9일 원/달러 환율이 1,380원대 초반에서 등락했다.이날 서울 외환시장에서 미국 달러화 대비 원화 환율의 오후 3시 30분 종가는 전 거래일보다 1.7원 내린 1,381.6원을 기록했다.환율은 전장보다 2.0원 내린 1,381.3원에 개장해 장중 1,386.4원까지 올랐다가 다시 하락해 1,380원대 초반으로 내려왔다.환율은 이날 예정된 제롬 파월 미국 연방준비제도 의장의 의회 증언을 대기하며 오르락내리락하는 모습을 보였다.이창용 한국은행 총재는 이날 국회 기획재정위원회 업무보고에 참석해 ""앞으로 유가 상승 등에 따라 둔화 흐름이 일시 주춤할 수는 있겠지만, 전반적 디스인플레이션 추세는 이어질 것""이라고 말했다.같은 시간 원/엔 재정환율은 100엔당 859.13원이다.","9일 원/달러 환율이 1,380원대 초반에서 등락했다."
20240709,"원/달러 환율, 장 초반 소폭 하락…1,380원대 초반",https://n.news.naver.com/mnews/article/001/0014794750,"9일 원/달러 환율이 소폭 하락 출발했다.이날 서울 외환시장에서 미국 달러화 대비 원화 환율은 오전 9시 10분 현재 전 거래일보다 0.5원 내린 1,382.8원에 거래되고 있다.환율은 전 거래일보다 2.0원 내린 1,381.3원에 개장해 좁은 폭에서 등락 중이다.환율은 이날 예정된 제롬 파월 미국 연방준비제도 의장의 의회 증언을 대기하며 횡보하는 장세를 보일 것으로 전망된다.이창용 한국은행 총재는 11일 금융통화위원회를 앞두고 이날 오전 10시 국회 기획재정위원회 업무보고를 한다.같은 시각 원/엔 재정환율은 100엔당 859.99원에 거래되고 있다.","서울 외환시장에서 미국 달러화 대비 원화 환율은 오전 9시 10분 현재 전 거래일보다 0.5원 내린 1,382.8원에 거래되고 있다."
20240710,"원/달러 환율, 1,380원대 중반 상승",https://n.news.naver.com/mnews/article/001/0014798734,"10일 원/달러 환율이 1,380원대 중반으로 상승했다.이날 서울 외환시장에서 미국 달러화 대비 원화 환율의 오후 3시 30분 종가는 전 거래일보다 3.1원 오른 1,384.7원을 기록했다.환율은 전날 제롬 파월 미국 연방준비제도 의장의 의회 증언을 소화하며 전 거래일보다 2.4원 오른 1,384.0원에 개장해 오전 중 1,388.1원까지 올랐다가 상승 폭을 줄였다.파월 의장은 최근 미국의 물가 상승률이 둔화하는 것을 긍정적으로 평가하면서도, 금리 인하 확신을 갖기 위해서는 하락세가 지속 가능하다는 증거가 더 필요하다고 밝혔다. 이후 달러화는 강세를 보였다.같은 시간 원/엔 재정환율은 100엔당 857.90원이다.","10일 원/달러 환율이 1,380원대 중반으로 상승했다."
20240710,"원/달러 환율, 파월 발언 여파에 상승 출발…1,380원대 중반",https://n.news.naver.com/mnews/article/001/0014797248,"10일 원/달러 환율이 글로벌 강달러 영향으로 상승 출발했다.이날 서울 외환시장에서 미국 달러화 대비 원화 환율은 오전 9시 12분 현재 전 거래일보다 4.1원 오른 1,385.7원에 거래되고 있다.환율은 전날 제롬 파월 미국 연방준비제도 의장의 의회 증언을 소화하며 전 거래일보다 2.4원 오른 1,384.0원에 개장해 상승세를 보이고 있다.파월 의장은 최근 미국의 물가 상승률이 둔화하는 것을 긍정적으로 평가하면서도, 금리 인하 확신을 갖기 위해서는 하락세가 지속 가능하다는 증거가 더 필요하다고 밝혔다.금리 인하 시점에 대해 명확한 신호가 나오지 않으면서 유로화와 엔화 등 6개 통화 대비 달러 가치를 나타내는 달러 인덱스는 뉴욕장 마감 무렵 105.13로 0.15% 올랐다.같은 시각 원/엔 재정환율은 100엔당 858.75원에 거래되고 있다.",10일 원/달러 환율이 글로벌 강달러 영향으로 상승 출발했다.
20240711,"원/달러 환율, 금통위 만장일치 금리동결에 1,370원대 하락",https://n.news.naver.com/mnews/article/001/0014801749,"11일 원/달러 환율이 '매파적'으로 해석된 한국은행 금융통화위원회 결과에 따라 1,370원대로 내려왔다.이날 서울 외환시장에서 미국 달러화 대비 원화 환율의 오후 3시 30분 종가는 전 거래일보다 5.9원 내린 1,378.8원을 기록했다.환율은 전 거래일보다 2.8원 내린 1,381.9원에 개장해 금통위 이후 쭉 내림세를 보였다.이날 한국은행 금통위는 만장일치로 기준금리를 연 3.5%로 동결했다.이창용 한은 총재는 금리 인하와 관련해 ""이제는 차선을 바꾸고 적절한 시기에 방향 전환을 할 준비를 하는 상황이 조성됐다""면서도 ""외환시장, 수도권 부동산, 가계부채 움직임 등 앞에서 달려오는 위험 요인이 많아 불확실한 상황이고, 상당한 시간이 걸릴 수도 있다""고 말했다.이 총재는 또 ""시장의 금리 인하 기대에 다소 과도한 측면이 있다""라고도 지적했다.같은 시간 원/엔 재정환율은 100엔당 853.15원이다.","11일 원/달러 환율이 '매파적'으로 해석된 한국은행 금융통화위원회 결과에 따라 1,370원대로 내려왔다."
20240712,"원/달러 환율, 미국 CPI 영향 되돌림에 1,370원대 후반 상승",https://n.news.naver.com/mnews/article/001/0014803948,"12일 원/달러 환율이 오전 하락분을 반납하고, 다시 1,370원대 후반까지 올랐다.이날 서울 외환시장에서 미국 달러화 대비 원화 환율의 오후 3시 30분 종가는 전 거래일보다 0.8원 오른 1,379.6원을 기록했다.이날 환율은 미국 소비자물가지수 둔화 소식에 전 거래일보다 6.8원 내린 1,372.0원에 개장해 장 초반 1,370원까지 내려갔다.그러나 장중 미국 국채 금리와 글로벌 달러 가치가 반등하는 등 미국CPI영향이 되돌려지면서 환율도 낙폭을 줄이고 상승 전환했다.같은 시간 원/엔 재정환율은 100엔당 866.88원이다.","12일 원/달러 환율이 오전 하락분을 반납하고, 다시 1,370원대 후반까지 올랐다."
20240712,"원/달러 환율, 미국 CPI 둔화에 1,370원대 초반 하락",https://n.news.naver.com/mnews/article/001/0014802957,"12일 원/달러 환율이 미국 소비자물가지수 둔화 소식에 하락했다.이날 서울 외환시장에서 미국 달러화 대비 원화 환율은 오전 9시 14분 현재 전 거래일보다 5.3원 내린 1,373.5원에 거래되고 있다.전날 오후 3시 30분 종가로 1,378.8을 기록했던 환율은 미국CPI둔화 소식에 이날 새벽 2시까지 이어진 야간거래에서 5.8원 하락해 1,373.0원에 장을 마쳤다.환율은 이날 1,372.0원에 개장한 이후 1,370원대 초반에서 움직이고 있다.11일 미국 노동부는 6월CPI가 전월보다 0.1% 하락했다고 발표했다. 이는 시장 예상치를 밑도는 것으로,CPI가 전월보다 하락한 것은 2020년 5월 이후 처음이다.한편 엔/달러 환율은 미국CPI발표 이후 뉴욕 외환시장에서 161.6엔대에서 157.4엔 전후까지 하락해 일본 당국이 또다시 시장 개입을 단행했다는 관측이 제기됐다.같은 시각 원/엔 재정환율은 100엔당 866.0원에 거래되고 있다.",12일 원/달러 환율이 미국 소비자물가지수 둔화 소식에 하락했다.
20240715,"원/달러 환율, 3.2원 상승…1,380원대로 올라",https://n.news.naver.com/mnews/article/001/0014807703,"15일 원/달러 환율이 1,380원대로 올라섰다.이날 서울 외환시장에서 미국 달러 대비 원화 환율의 오후 3시 30분 종가는 전거래일보다 3.2원 상승한 1,382.8원을 기록했다.원/달러 환율은 미국 경제지표 둔화 영향으로 전거래일보다 2.6원 내린 1,377.0원에 개장해 장중 1,383.7원까지 올랐다.이날 원/달러 환율은 글로벌 강달러 흐름을 반영해 오름세를 보였다.민경원 우리은행 이코노미스트는 ""수입업체 결제 확대가 하단을 지지한다""고 설명했다.아울러 유가증권시장에서 외국인이 799억원가량을 순매도한 점도 원화 약세에 힘을 보태는 요인이다.같은 시간 원/엔 재정환율은 100엔당 874.06원이다.","15일 원/달러 환율이 1,380원대로 올라섰다."
20240715,"원/달러 환율, 장초반 보합권…1,377.0원 출발",https://n.news.naver.com/mnews/article/001/0014806543,"15일 원/달러 환율은 장초반 보합권이다.이날 서울 외환시장에서 미국 달러 대비 원화 환율은 오전 9시 12분 현재 전거래일과 동일한 1,379.6원이다.원/달러 환율은 전거래일보다 2.6원 내린 1,377.0원에 출발해 박스권에서 등락하고 있다.문정희 국민은행 연구원은 ""지난 14일 도널드 트럼프 전 미국 대통령이 펜실베니아주 유세 중 총격을 당했지만 '트럼프 대세론'이 선반영됐기 때문에 시장에 미치는 영향은 제한적""이라고 설명했다.전거래일 달러는 미국 경제지표 둔화로 약세를 보였다.미국 6월 생산자물가지수는 전월 대비 0.2% 상승해 시장 예상치를 소폭 상회했지만 핵심PPI는 보합을 기록, 예상치를 하회했다.이에 주요 6개국 통화에 대한 달러 가치를 나타내는 달러 인덱스는 0.35% 하락한 104.09를 기록했다.같은 시간 원/엔 재정환율은 100엔당 871.36원에 거래되고 있다.",15일 원/달러 환율은 장초반 보합권이다.
20240716,"원/달러 환율, 주간거래서 2.1원 상승…1,384.9원",https://n.news.naver.com/mnews/article/001/0014810000,"16일 원/달러 환율은 주간거래에서 상승세를 보였다.이날 서울 외환시장에서 미국 달러화 대비 원화 환율의 오후 3시 30분 종가는 전날보다 2.1원 오른 1,384.9원을 기록했다.원/달러 환율은 전날보다 1.2원 상승한 1,384.0원에 개장한 뒤 1,387원대까지 올랐지만, 오후 들어 상승 폭을 줄였다.환율은 '트럼프 트레이드'로 미국 국채 장기금리가 상승하며 장 초반 상승 폭을 키웠다가 이날 발표될 미국 소매판매 발표를 대기하는 양상을 보였다.아울러 수입업체 결제 수요도 달러 강세 요인으로 작용했다.같은 시간 원/엔 재정환율은 100엔당 873.45원이다.",16일 원/달러 환율은 주간거래에서 상승세를 보였다.
20240716,"원/달러 환율, '트럼프 트레이드'에 장초반 상승세…1,380원대",https://n.news.naver.com/mnews/article/001/0014808713,"16일 원/달러 환율은 장초반 상승세다.이날 서울 외환시장에서 미국 달러화 대비 원화 환율은 오전 9시 17분 현재 전날보다 3.9원 상승한 1,386.7원이다.원/달러 환율은 전날보다 1.2원 상승한 1,384.0원에 개장한 이후 상승 폭을 다소 높였다.간밤 달러는 제롬 파월 미국 연방준비제도 의장의 금리 인하 기대감 발언에도 국채 금리 상승에 연동, 강세를 보였다.파월 의장은 워싱턴D.C.에서 열린 경제클럽 콘퍼런스에서 ""통화정책 시차를 고려했을 때 인플레이션이 2%에 도달할 때까지 기다리는 것은 늦을 수 있다""고 말했다.하지만 도널드 트럼프 전 대통령의 당선 가능성이 높아진 가운데 트럼프 수혜주에 배팅하는 '트럼프 트레이드'로 국채금리가 상승, 달러 강세에 영향을 미쳤다.트럼프 전 대통령이 이전 집권 당시 세금은 줄이고 재정지출을 늘리는 정책을 편 만큼 시장은 장기 금리가 오른다고 판단, 전날 미국채 10년물은 4.7bp 상승했다.같은 시간 원/엔 재정환율은 100엔당 876.3원이다.",16일 원/달러 환율은 장초반 상승세다.
20240717,"원/달러 환율, 달러 약세에 주간거래서 하락…1,381.5원",https://n.news.naver.com/mnews/article/001/0014812346,"17일 원/달러 환율은 주간거래에서 하락세를 나타냈다.이날 서울 외환시장에서 미국 달러화 대비 원화 환율의 오후 3시 30분 종가는 전날보다 3.4원 하락한 1,381.5원이다.원/달러 환율은 전일보다 1.9원 내린 1,383.0원에 개장해 장중 1,379.3원까지 떨어지기도 했다.이날 달러는 미국 연방준비제도의 9월 기준금리 인하 기대로 약세를 보였다. 주요 6개국에 대한 달러 가치를 나타내는 달러 인덱스는 104.18까지 떨어지기도 했다.다만 저점 매수를 노린 수입업체 결제 수요에 원/달러 환율은 1,380원대를 회복했다.같은 시간 원/엔 재정환율은 100엔당 874.71원이다.",17일 원/달러 환율은 주간거래에서 하락세를 나타냈다.
20240718,"원/달러 환율, 주간거래서 소폭 상승…0.2원 오른 1,381.7원",https://n.news.naver.com/mnews/article/001/0014815330,"18일 원/달러 환율은 주간거래에서 소폭 상승했다.이날 서울 외환시장에서 미국 달러화 대비 원화 환율의 오후 3시 30분 종가는 전날보다 0.2원 상승한 1,381.7원이다.원/달러 환율은 전일보다 2.5원 하락한 1,379.0원에 개장해 1,376.5∼1,382.4원에서 움직였다.이날 달러는 도널드 트럼프 전 미국 대통령이 블룸버그 인터뷰에서 ""엔화가 너무 저렴하다""며 엔화 약세를 비판한 영향을 받았다. 이 발언에 엔화 가치가 급등하며 달러가 약세를 보였고, 장중 한때 원/달러 환율도 1,376.5원까지 떨어졌다.하지만 오후 들어 저가 매수가 들어오며 원/달러 환율은 하락분을 되돌렸다.같은 시간 원/엔 재정환율은 100엔당 884.37원이다.",18일 원/달러 환율은 주간거래에서 소폭 상승했다.
20240718,NH농협카드도 트래블카드…국내 무제한캐시백·해외수수료 면제,https://n.news.naver.com/mnews/article/001/0014813627,"해외 여행객 증가로 해외 카드매출이 늘어나면서 외화 환전과 해외 결제, 출금 수수료 무료 등 혜택을 제공하는 해외여행 특화카드 경쟁이 치열해지고 있다.NH농협카드는 해외 결제 특화카드인'NH트래블리체크카드'를 출시했다고 18일 밝혔다.이 카드는 해외 결제·출금 시 원화 환산 절차 없이 현지 통화로 결제·출금된다.출시일 기준 환전 가능 통화는 미국 달러, 일본 엔, 유로 등 20종이다.해외 가맹점 결제 및 해외ATM·창구 현금인출 시 국제브랜드 수수료 및 해외 서비스 수수료가 면제된다.특히 전월 실적 조건 없이도 국내 가맹점에서 이용 금액의 0.2% 캐시백 혜택을 제공하며 국내 온라인 가맹점에서NH페이로 결제할 경우 0.3% 캐시백, 국내 ㆍ편의점ㆍ커피전문점ㆍ대중교통 이용 시 0.6% 캐시백을 제공한다.NH농협카드 관계자는 ""NH농협카드에서도 해외여행 필수 아이템으로 자리한 트래블카드를 선보이게 됐다""며 ""해외여행뿐 아니라 국내 이용에서도 강점이 있는 상품""이라고 말했다.NH농협카드는 카드 출시를 기념해 '하고싶은대로NH트래블리' 이벤트를 진행한다.",해외 여행 특화카드인 'NH트래블리체크카드'는 해외 결제·출금 시 원화 환산 절차 없이 현지 통화로 결제·출금된다.
20240718,"환율, 美 매파 인사 '금리 인하 기대' 발언에 장초반 하락세",https://n.news.naver.com/mnews/article/001/0014813585,"18일 원/달러 환율은 장초반 하락세다.이날 서울 외환시장에서 미국 달러화 대비 원화 환율은 오전 9시 15분 현재 전일보다 3.8원 하락한 1,377.7원에 거래되고 있다.원/달러 환율은 전날보다 2.5원 낮아진 1,379.0원에 출발해 1,370원대 후반에서 등락하고 있다.간밤 달러는 미국 연방준비제도 내 매파 인사의 금리인하 옹호 발언에 약세를 보였다.존 윌리엄스 뉴욕 연방준비은행 총재는 ""최근 물가 지표는 디스인플레이션 추세가 이어지고 있음을 나타낸다""고 말했다.크리스토퍼 월러 이사 연준 이사도 ""금리 인하 시점이 가까워지고 있다""고 전했다.이에 주요 6개국 통화에 대한 달러 가치를 나타내는 달러인덱스는 0.49% 하락한 103.73을 기록했다.같은 시간 원/엔 재정환율은 100엔당 885.25원이다.",18일 원/달러 환율은 장초반 하락세다.
20240719,"원/달러 환율, 주간거래서 상승…5.0원 오른 1,386.7원",https://n.news.naver.com/mnews/article/001/0014817613,"19일 원/달러 환율은 주간거래에서 상승세를 보였다.이날 서울 외환시장에서 미국 달러화 대비 원화 환율의 오후 3시 30분 종가는 전일보다 5.0원 상승한 1,386.7원을 기록했다.원/달러 환율은 전일보다 3.8원 오른 1,385.5원에 개장해 1,384.6∼1,387.7원 사이에서 등락했다.이날 위안화 약세에 연동해 원화는 약세를 보였다.중국 인민은행에 따르면 이날 위안/달러 기준환율은 전장 대비 0.003위안 오른 7.1315위안이다.아울러 간밤 유럽중앙은행의 9월 기준금리 인하 기대감으로 유로화가 약세를 보인 것도 원/달러 환율의 상승 요인으로 작용했다.같은 시간 원/엔 재정환율은 100엔당 878.97원이다.",19일 원/달러 환율은 주간거래에서 상승세를 보였다.
20240719,"원/달러 환율, 장초반 상승세…3.8원 오른 1,385.5원 출발",https://n.news.naver.com/mnews/article/001/0014816651,"19일 원/달러 환율은 글로벌 달러 강세 영향으로 장초반 상승세다.이날 서울 외환시장에서 미국 달러화 대비 원화 환율은 오전 9시 17분 현재 전날 주간거래 종가 대비 4.3원 오른 1,386.0원을 기록했다.원/달러 환율은 전날보다 3.8원 상승한 1,385.5원에 개장해 1,380원 후반대에서 움직이고 있다.간밤 달러화는 유럽중앙은행의 금리 인하 가능성에 강세를 보였다.크리스틴 라가르드ECB총재는 전날 정례 통화정책회의에서 예상대로 금리를 동결했지만, 기자회견을 통해 9월 추가 인하 가능성을 열어뒀다.이에 이날 새벽 2시에 마감한 서울 외환시장 야간거래에서 원/달러 환율은 주간거래 종가보다 1.70원 오른 1,383.40원을 기록했다.같은 시간 원/엔 재정환율은 100엔당 881.15원이다.",19일 원/달러 환율은 글로벌 달러 강세 영향으로 장초반 상승세다.
20240722,"원/달러 환율, 주간거래서 소폭 상승…1,388.2원",https://n.news.naver.com/mnews/article/001/0014821473,"원/달러 환율이 22일 주간거래에서 소폭 상승 마감했다.이날 서울 외환시장에서 미국 달러화 대비 원화 환율의 오후 3시30분 종가는 전 거래일보다 1.5원 오른 1,388.2원을 기록했다.원/달러 환율은 전 거래일보다 1.3원 오른 1,388.0원으로 개장한 뒤 횡보했다. 장중 한때 1,390원을 터치하기도 했지만 오후 들어 상승 폭이 줄었다.간밤 조 바이든 미국 대통령이 민주당 대선 후보직에서 전격 사퇴한 여파를 소화하는 국면으로 전문가들은 분석하고 있다.당분간 불확실성이 이어지면서 환율 변동성도 다소 커질 수 있겠지만, 외환당국 개입에 대한 경계감으로 1,390원 선을 크게 웃돌지는 않을 것이라는 전망이 우세하다.같은 시각 원/엔 재정환율은 100엔당 886.43원에 거래됐다.","서울 외환시장에서 미국 달러화 대비 원화 환율의 오후 3시30분 종가는 전 거래일보다 1.5원 오른 1,388.2원을 기록했다."
20240722,"원/달러 환율, 장 초반 소폭 상승…1,387.7원",https://n.news.naver.com/mnews/article/001/0014820332,"원/달러 환율은 22일 장 초반 소폭 상승하고 있다.이날 서울 외환시장에서 미국 달러화 대비 원화 환율은 오전 9시10분 현재 전 거래일 주간거래 종가보다 1.0원 오른 1,387.7원에 거래되고 있다.원/달러 환율은 전 거래일보다 1.3원 오른 1,388.0원으로 개장한 뒤 횡보하는 흐름이다.간밤 조 바이든 미국 대통령이 민주당 대선 후보직에서 전격 사퇴한 여파를 소화하는 국면으로 전문가들은 분석하고 있다.당분간 불확실성이 이어지면서 환율 변동성도 다소 커질 수 있다는 전망이 나온다.앞서 전 거래일 새벽 2시에 마감한 서울 외환시장 야간 거래에서는 원/달러 환율이 주간 거래 종가보다 3.5원 오른 1,390.2원으로 마감했다. 마이크로소프트 발IT대란의 영향으로 환율이 오름세를 나타냈다.이날 오전 9시10분 원/엔 재정환율은 100엔당 881.66원에 거래되고 있다.",원/달러 환율은 22일 장 초반 소폭 상승하고 있다.
20240723,"원/달러 환율, 위험선호 심리 강화에 하락…1,386.2원",https://n.news.naver.com/mnews/article/001/0014823879,"원/달러 환율은 23일 위험선호 심리 강화에 하락했다.이날 서울 외환시장에서 미국 달러화 대비 원화 환율의 오후 3시30분 종가는 전날보다 2.0원 내린 1,386.2원을 기록했다.환율은 전날보다 0.8원 오른 1,389.0원으로 개장한 직후 하락세로 전환했다. 오후 들어 1,382.6원까지 내렸다가 하락 폭이 축소됐다.간밤 뉴욕 증시에서는 기술주가 반등하면서 위험선호 심리가 강화되고 글로벌 달러가 소폭 약세를 나타냈다. 이날 국내 증시에서도 2천410억원의 외국인 순매수가 기록됐다.미국 대선 관련 불확실성이 이어지는 가운데 당장 예정된 주요 경제지표 발표가 없어 시장 방향성은 뚜렷하지 않은 흐름이다.같은 시각 원/엔 재정환율은 100엔당 885.55원에 거래됐다.",원/달러 환율은 23일 위험선호 심리 강화에 하락했다.
20240723,"환율, 위험선호 심리 강화에 소폭 하락…1,386.6원",https://n.news.naver.com/mnews/article/001/0014822619,"원/달러 환율은 23일 장 초반 소폭 하락하고 있다.이날 서울 외환시장에서 미국 달러화 대비 원화 환율은 오전 9시10분 현재 전날 주간 거래 종가보다 1.6원 내린 1,386.6원에 거래되는 중이다.환율은 전날보다 0.8원 오른 1,389.0원으로 개장한 직후 하락세로 전환했다.간밤 뉴욕 증시에서는 기술주가 반등하면서 위험선호 심리가 강화되고 글로벌 달러가 소폭 약세를 나타냈다. 이날 국내 증시에서도 장 초반 외국인 매수세가 유입됐다.미국 대선 관련 불확실성이 이어지는 가운데 당장 예정된 주요 경제지표 발표가 없어 시장 방향성은 뚜렷하지 않은 흐름이다.앞서 이날 새벽 2시에 마감한 서울 외환시장 야간 거래에서 원/달러 환율은 주간 거래 종가와 같은 1,388.2원으로 마감했다.이날 오전 9시10분 현재 원/엔 재정환율은 100엔당 884.86원에 거래되고 있다.",원/달러 환율은 23일 장 초반 소폭 하락하고 있다.
20240724,"원/달러 환율, 日 엔화 강세에 하락…1,383.8원",https://n.news.naver.com/mnews/article/001/0014826781,"원/달러 환율은 24일 일본 엔화 강세에 하락 마감했다.이날 서울 외환시장에서 미국 달러화 대비 원화 환율의 오후 3시30분 종가는 전날보다 2.4원 내린 1,383.8원을 기록했다.환율은 전날보다 0.8원 오른 1,387.0원으로 개장했으나 오전 9시50분께 하락세로 전환했고, 오후 한때 1,383.0원까지 떨어졌다.최근 일본 집권 자민당 주요 인사들의 기준금리 인상 압박에 엔화가 강세를 나타내면서 원/달러 환율에도 영향을 미친 것으로 보인다.같은 시각 원/엔 재정환율은 100엔당 895.11원에 거래됐다. 전날 오후 3시30분 기준가인 885.55원보다 9.65원 상승했다.원/엔 환율은 이날 오후 2시30분께 897.05원까지 올랐다.",원/달러 환율은 24일 일본 엔화 강세에 하락 마감했다.
