date,title,url,content,summary
20241110,④ 금·달러 투자 열풍…가상자산도 '불장',https://n.news.naver.com/mnews/article/001/0015035709,"미국 대선을 앞두고 대표적인 안전 자산인 금과 달러화 투자에 시중 자금이 대거 몰렸던 것으로 나타났다.은행을 통한 실물 금 투자 판매액과 골드뱅킹 잔액은 역대 최대 규모를 기록했고, 달러 예금과 원/달러 환전 수요도 눈에 띄게 늘었다.도널드 트럼프 전 미 대통령의 극적인 당선 직후에는 비트코인을 위시한 가상자산 거래가 폭발적으로 증가하는 등 '머니 무브' 조짐도 감지됐다.5대 은행 골드바·골드예금 판매 나란히 최대최근 금 가격이 사상 최고로 오르면서 금 투자가 큰 인기를 끌었다.10일 금융권에 따르면 5대 은행의 지난달 골드바 판매액은 259억원에 달해 역대 최대를 기록했다.종전 최대는 지난 8월의 208억원이었다.한국거래소 금 시장에서 1kg짜리 금 현물은 지난달 23일 1g당 13만50원으로 사상 처음 13만원을 돌파했다. 지난 8일 종가는 12만1천220원이었다.골드뱅킹에도 돈이 몰렸다.KB국민·신한·우리은행의 지난달 골드뱅킹 잔액은 7천773억원으로 역시 역대 최대를 기록했다.골드뱅킹은 은행 예금의 일종으로, 계좌에 돈을 넣어두면 국제 금 시세에 따라 잔액이 불거나 줄어드는 투자 상품이다.다만, 이런 금 투자 열풍은 이달 들어 다소 진정되는 흐름이다.실제 5대 은행의 골드바 판매액은 이달 들어 7일까지 34억원에 그쳤다.골드뱅킹 잔액도 7일 기준 7천613억원으로 전월 말보다 160억원 줄었다. 지난 5월부터 매달 잔액이 증가하다가 6개월 만에 감소세로 전환했다.시장에선 미 대선을 변곡점으로 금 투자 매력이 줄었다는 분석도 나온다.정성진KB국민은행 강남스타PB센터 부센터장은 ""트럼프 행정부 경제 정책이 달러 가치를 높이면 금 시세 하락의 원인이 될 것""이라고 말했다.롤러코스터 탄 환율에 달러 예금·환전 수요 늘어최근 원/달러 환율 변동성이 확대되면서 달러화 투자도 활황이었다.5대 은행의 달러 예금 잔액은 지난 9월 말 638억9천600만달러로, 2023년 1월 말 이후 1년 8개월 만에 최대 규모를 기록했다.이후 지난달 말 603억2천200만달러로 잔액이 줄었다.지난 9월 말 1,300원대 초반까지 내렸던 환율이 10월 말 1,390원대로 가파르게 반등하자 투자자들이 고점 매도를 노리고 예금에서 돈을 인출한 것으로 보인다.환전 규모도 비슷한 흐름을 나타냈다.지난달 5대 은행의 달러 매수, 즉 고객 입장에선 달러화를 원화로 환전한 금액은 2억2천900만달러로 집계됐다. 지난해 10월 이후 1년 만의 최대 규모였다.이와 반대로 지난달 5대 은행의 달러 매도는 2억7천600만달러로, 지난해 4월 이후 1년 6개월 만에 최소 규모를 기록했다.그만큼 갖고 있던 달러를 원화로 환전한 투자자가 늘고, 원화를 달러로 바꾼 투자자는 줄었다는 뜻이다.미국 대선 이후로는 원/달러 환율이 심리적 마지노선인 1,400원대까지 치솟으면서 환 투자에 대한 관심이 한층 높아진 분위기다.투자자들이 환율 추가 상승을 염두에 두고 거듭 달러를 사들일지 주목되는 상황이다.박형중 우리은행 이코노미스트는 ""트럼프 당선인의 공약이 정책에 반영된다면 환율은 1,400원을 상회할 것""이라며 ""내년 평균 환율이 올해보다 낮지 않을 전망""이라고 말했다.미국 달러화 트럼프 당선에 3배 넘게 뛴 코인 거래량대표적 트럼프 수혜 자산으로 꼽히는 가상자산은 미 대선 이후 크게 주목받고 있다.미 가상자산 거래소 코인베이스에 따르면 비트코인 가격은 선거 직전엔 개당 6만7천달러대로 떨어졌다가 최근 7만7천달러를 넘으며 기록을 경신했다.국내 최대 가상자산 거래소인 업비트를 통한 비트코인 일 거래량은 지난 6일 1만7천174개로 전날보다 259% 급증했다.같은 날 대표적인 알트코인인 이더리움과 솔라나 거래량도 6만7천606개, 157만6천416개로 전날보다 각각 265%, 269% 증가했다.도지코인 거래량 역시 283% 늘어난 84억615만1천246개에 달해 눈길을 끌었다.","은행을 통한 실물 금 투자 판매액과 골드뱅킹 잔액은 역대 최대 규모를 기록했고, 달러 예금과 원/달러 환전 수요도 눈에 띄게 늘었다."
20241111,"환율, 강달러·외국인 증시 매도에 8.3원 상승…1,394.7원",https://n.news.naver.com/mnews/article/001/0015038439,"원/달러 환율은 11일 상승했다.이날 서울 외환시장에서 미국 달러화 대비 원화 환율의 주간 거래 종가는 전 거래일보다 8.3원 오른 1,394.7원을 기록했다.환율은 전 거래일보다 9.6원 오른 1,396.0원에 출발한 뒤 1,390원대 중반에서 등락했다.달러는 미국 보호무역주의 정책에 대한 경계감에 연일 강세를 나타내고 있다.주요 6개국 통화 대비 달러 가치를 나타내는 달러인덱스는 전 거래일보다 0.51% 상승한 105.060을 기록했다.외국인의 국내 증시 매도세도 환율 상승 요인으로 작용했다.이날 코스피는 전 거래일보다 29.49포인트 내린 2,531.66으로 장을 마쳤다.","미국 달러화 대비 원화 환율의 주간 거래 종가는 전 거래일보다 8.3원 오른 1,394.7원을 기록했다."
20241111,"환율, 美 달러 강세에 장 초반 상승…1,390원대 중반",https://n.news.naver.com/mnews/article/001/0015037293,"원/달러 환율은 11일 장 초반 1천390원대 중반으로 상승했다.이날 서울 외환시장에서 미국 달러화 대비 원화 환율은 오전 9시 30분 현재 전 거래일 주간 거래 종가보다 8.0원 오른 1,394.4원에 거래되고 있다.원/달러 환율은 전 거래일보다 9.6원 오른 1,396.0원으로 출발했다.달러는 미국 보호무역주의 정책에 대한 경계감에 강세를 나타냈다.주요 6개국 통화 대비 달러 가치를 나타내는 달러인덱스는 전 거래일보다 0.44% 상승한 104.983을 기록하고 있다.중국 경기부양책에 대한 실망감으로 위안화가 약세를 나타낸 것도 원/달러 환율에 상승압력으로 작용할 전망이다.중국은 지난주 전국인민대표대회에서 지방정부 부채 문제에 대응하기 위해 총 10조 위안 규모의 부채 대책을 발표했지만, 시장에서는 실망스럽다는 반응이 나왔다.다만 수출업체 매도 물량 유입 가능성은 환율 상단을 제한하는 요인이다.같은 시각 원/엔 재정환율은 100엔당 911.71원을 기록 중이다.",원/달러 환율은 11일 장 초반 1천390원대 중반으로 상승했다.
20241112,"다시 1,400원대…'트럼프 트레이드'에 환율 상승세",https://n.news.naver.com/mnews/article/001/0015039383,"원/달러 환율은 12일 장 초반 상승해 심리적 마지노선으로 불리는 1,400원 선을 재돌파했다.이날 서울 외환시장에서 미국 달러화 대비 원화 환율은 오전 9시5분 현재 전날 주간 거래 종가보다 6.0원 오른 1,400.7원을 기록하고 있다.원/달러 환율은 전날보다 4.4원 오른 1,399.1원으로 개장한 직후 1,400원을 넘어섰다.이날 새벽 2시 종가는 1,401.0원이었다. 종가 기준 1,400원을 웃돈 것은 지난 2022년 11월 7일 이후 2년여 만에 처음이었다. 당시는 야간 거래가 개장하기 전이다.주요 6개국 통화 대비 달러 가치를 나타내는 달러인덱스는 전날보다 0.06% 내린 105.44 수준이다.도널드 트럼프 전 미국 대통령의 당선 이후 한층 뚜렷해진 달러 강세가 주요 환율 상승 요인으로 꼽힌다.더구나 국내 증시에서 외국인 매도세가 나타나며 시황이 부진한 가운데 미국 증시는 '트럼프 트레이드'를 바탕으로 사상 최고가 경신을 이어가는 상황이다.간밤 미국 뉴욕 증시에서는 다우존스30 산업평균지수·스탠더드앤드푸어스 500 지수·나스닥 지수 등 3대 지수가 나란히 최고가를 새로 썼다.미국 외환 시장과 채권 시장은 재향군인의 날로 휴장했다.민경원 우리은행 연구원은 ""트럼프 트레이드가 연일 이어지면서 달러화 강세가 외환시장 전반에 영향을 주고 있다""고 말했다.이어 ""트럼프 당선 이후 감세 연장과 규제 완화 기대로 미국 주식이 상대적으로 양호한 성과를 보일 것으로 예상된다""며 ""미국 주식 투자를 위한 환전 수요가 꾸준히 나타날 전망""이라고 덧붙였다.이민혁KB국민은행 연구원은 ""미국 하원에서도 공화당 과반 확보가 유력해지며 '레드 스윕' 실현 가능성이 커졌다""며 ""이로 인한 트럼프 트레이드가 달러 강세, 원화 약세의 요인이 되고 있다""고 분석했다.같은 시각 원/엔 재정환율은 100엔당 911.99원에 거래되고 있다.","원/달러 환율은 12일 장 초반 상승해 심리적 마지노선으로인 1,400원 선을 재돌파했다."
20241113,"환율 2년만에 장중 1,410원 넘어…강달러·외국인 순매도에↑",https://n.news.naver.com/mnews/article/001/0015043381,"13일 원/달러 환율은 장중 1,410원 선을 넘어서는 등 2년 만에 최고 수준까지 올랐다.이날 서울 외환시장에서 미국 달러화 대비 원화 환율의 주간 거래 종가는 전날보다 3.1원 오른 1,406.6원을 기록했다.주간 거래 종가 기준으로 지난 2022년 11월 4일 이후 가장 높았다.환율은 전날보다 6.5원 오른 1,410.0원으로 출발한 뒤 1,403.7∼1,410.6원에서 움직였다.달러는 '트럼프 트레이드',미 물가 지표 발표를 앞둔 경계감 등 영향으로 강세를 보였다.주요 6개국 통화 대비 달러 가치를 나타내는 달러인덱스는 전날보다 0.35% 오른 106.045 수준이다.외국인의 국내 증시 순매도도 환율 상승 요인으로 작용했다.이날 코스피는 전 거래일보다 65.49포인트 내린 2,417.08로 장을 마쳤다. 외국인들은 이날 유가증권시장에서 약 7천103억원을 순매도했다.오후 3시 30분 기준 원/엔 재정환율은 100엔당 906.99원이다.","13일 원/달러 환율은 장중 1,410원 선을 넘어서는 등 2년 만에 최고 수준까지 올랐다."
20241114,원/달러 환율 추이,https://n.news.naver.com/mnews/article/001/0015046558,14일 원/달러 환율은 하락했다.,"14일 14일/원 원 원 원 원 원 원 원 원 원 원 원 원 원 원 원 원 원 원 원 원 원 원 원 원 원 원 원 원 원 원 원 원 원 원 원/달러 환율은 하락했다. 14일 14일 14일 14일 14일, 14일 14일, 14일 14일, 14일 14일, 14일 14일"
20241114,"환율, 구두개입에도 1,400원대…1.5원 내린 1,405.1원",https://n.news.naver.com/mnews/article/001/0015046446,"14일 원/달러 환율은 하락했다. 미국 대선 이후  달러 강세가 지속되고 있지만 외환당국에서 구두 개입이 나오면서 시장 경계감이 높아졌다.이날 서울 외환시장에서 미 달러화 대비 원화 환율의 주간 거래 종가는 전날보다 1.5원 내린 1,405.1원을 기록했다.환율은 전날보다 3.0원 내린 1,403.6원에 개장한 뒤 1,403.6∼1,409.3원에서 등락했다.미 달러는 이날도 강세였다. 주요 6개국 통화 대비 달러 가치를 나타내는 달러인덱스는 전날보다 0.54% 오른 106.630 수준이다.달러인덱스는 이날 한 때 106.776까지 뛰었는데, 이는 지난해 11월 1일 이후 1년 만에 가장 높은 수준이다.미 10월 소비자물가지수가 예상에 부합하며 12월 연준 금리 인하 기대감을 살렸으나 '트럼프 랠리'의 여파가 이어지고 있다.특히 도널드 트럼프 전 대통령의 당선과 함께 미 공화당이 연방 상·하원 모두를 장악하는 '레드 스윕'이 확정된 것도 달러 가치를 끌어올렸다.다만 이날 개장 전 외환당국이 구두개입을 하면서 환율은 하락압력을 받았다.최상목 부총리 겸 기획재정부 장관은 이날 오전 서울 은행회관에서 주재한 '긴급 거시경제·금융현안 간담회'에서 ""미국 신정부의 정책 기조 변화와 함께 세계 경제 성장·물가 흐름, 주요국 통화정책 기조와 관련해 불확실성이 상존하고 있다""며 ""관계기관 24시간 합동점검체계를 중심으로 각별한 긴장감을 갖고 시장 상황을 예의주시하겠다""고 밝혔다.최 부총리는 ""상황별 대응계획에 따른 공조·대응체계 유지에 만전을 다하는 동시에 금융·외환시장 변동성이 과도하게 확대되는 경우에는 적극적 시장안정 조치를 적기에 신속히 시행해달라""고 관계기관에 당부했다.오후 3시 30분 기준 원/엔 재정환율은 100엔당 901.49원이다.",14일 원/달러 환율은 하락했다.
20241114,"외환당국 구두 개입에 환율 혼조세…1,406원선",https://n.news.naver.com/mnews/article/001/0015045353,"14일 원/달러 환율은 외환 당국 구두 개입 이후 장 초반 혼조세를 나타내고 있다.이날 서울 외환시장에서 미국 달러화 대비 원화 환율은 오전 10시 19분 현재 전날 주간 거래 종가보다 0.5원 내린 1,406.1원에 거래되고 있다.원/달러 환율은 전날보다 3.0원 하락한 1,403.6원에 개장했다. 이날 새벽 2시 종가는 1,397.5원을 기록했다.환율이 전날 장 중 1,410원 선을 넘어서는 등 급등세를 보이자 외환 당국은 이날 구두 개입에 나섰다.최상목 부총리 겸 기획재정부 장관은 이날 오전 서울 은행회관에서 주재한 '긴급 거시경제·금융현안 간담회'에서 ""미국 신정부의 정책 기조 변화와 함께 세계 경제 성장·물가 흐름, 주요국 통화정책 기조와 관련해 불확실성이 상존하고 있다""며 ""관계기관 24시간 합동점검체계를 중심으로 각별한 긴장감을 갖고 시장 상황을 예의주시하겠다""고 밝혔다.최 부총리는 ""상황별 대응계획에 따른 공조·대응체계 유지에 만전을 다하는 동시에 금융·외환시장 변동성이 과도하게 확대되는 경우에는 적극적 시장안정 조치를 적기에 신속히 시행해달라""고 관계기관에 당부했다.외환당국 구두 개입은 중동정세 불안으로 환율이 1,400원 부근까지 상승한 지난 4월 중순 이후 7개월 만이다.이날 구두 개입에도 불구하고 환율은 낙폭을 줄이다가 상승 반전해 1,407.8원까지 오르기도 했다.달러는 간밤 강세를 나타냈다. 주요 6개국 통화 대비 달러 가치를 나타내는 달러인덱스는 전날보다 0.47% 오른 106.563 수준이다.미 10월 소비자물가지수가 예상에 부합하며 12월 연준 금리 인하 기대감을 살렸으나 '트럼프 랠리'의 여파가 이어지고 있다.같은 시각 원/엔 재정환율은 100엔당 902.13원에 거래되고 있다. 전날 오후 3시 30분 기준가인 906.99원보다 4.86원 하락한 수준이다.엔/달러 환율은 전날보다 0.51% 상승한 155.87엔이다.한편 이날 서울 외환시장은 대학수학능력시험일을 맞아 평소보다 1시간 늦은 오전 10시에 개장했다.",14일 원/달러 환율은 외환 당국 구두 개입 이후 장 초반 혼조세를 나타내고 있다.
20241115,"환율, 4일 만에 1,400선 아래로…6.3원 내린 1,398.8원",https://n.news.naver.com/mnews/article/001/0015049126,"15일 원/달러 환율이 하락해 1,400원 선 아래로 내려왔다.이날 서울 외환시장에서 미 달러화 대비 원화 환율의 주간 거래 종가는 전날보다 6.3원 내린 1,398.8원을 기록했다.주간 거래 종가가 1,300원대로 내려온 것은 지난 11일 이후 4일 만이다.환율은 전날보다 2.9원 상승한 1,408.0원에 개장해 장 초반 1,408.8원까지 올랐다.'트럼프 랠리' 여파가 이어지는 가운데, 제롬 파월 미 연방준비제도 의장이 금리 인하 속도 조절을 시사하면서 달러가 강세를 보인 영향이다.주요 6개국 통화 대비 달러 가치를 나타내는 달러인덱스는 전날보다 0.17% 오른 106.812다.환율은 이날 국내 증시, 위안화에 연동해서 점차 하락하다가 오후에는 1,400원 선 아래까지 내렸다.이날 코스피는 0.08% 내린 2,416.86에, 코스닥지수는 0.57% 오른 685.42에 마감했다. 외국인은 유가증권시장에서 약 759억원을 순매도했지만, 코스닥시장에서는 827억원을 순매수했다.역외 위안/달러 환율은 전날보다 0.06% 내린 7.2347위안을 기록했다.오후 3시 30분 기준 원/엔 재정환율은 100엔당 894.97원이다.","15일 원 달러화 대비 원화 환율의 주간 거래 종가는 전날보다 6.3원 내린 1,398.8원을 기록했다."
20241115,"환율, 미 금리 인하 속도 둔화 전망에 다시 상승…1,407원대",https://n.news.naver.com/mnews/article/001/0015048123,"미국 금리 인하 속도가 느려질 것이란 전망에 14일 원/달러 환율이 다시 상승했다.이날 서울 외환시장에서 미 달러화 대비 원화 환율은 오전 9시 38분 현재 전날 주간 거래 종가보다 2.3원 오른 1,407.4원에 거래되고 있다.원/달러 환율은 전날보다 2.9원 상승한 1,408.0원에 개장했다. 이날 새벽 2시 종가는 1,402.5원을 기록했다.달러는 간밤 강세를 나타냈다. 주요 6개국 통화 대비 달러 가치를 나타내는 달러인덱스는 전날보다 0.28% 오른 106.924 수준이다.제롬 파월 미 연방준비제도 의장이 금리 인하 속도 조절을 시사한 영향이다.파월 의장은 14일  댈러스 연은 주최 행사에 참석해 연준의 통화정책 방향에 관해 ""미 경제가 금리 인하를 서두를 필요가 있다는 어떤 신호도 보내고 있지 않다""라고 밝혔다.이어 ""현재 우리가 미국 경제에서 보고 있는 강함은  결정을 신중하게 접근할 수 있는 능력을 제공한다""라고 말했다.시카고상품거래소 페드워치에 따르면 금리 선물시장은 이날 파월 의장 발언 후 12월 연방공개시장위원회 회의에서 연준이 금리를 동결할 확률을 51.7%로 반영했다. 이는 전날의 17.5%에서 급등한 수치다.한편 미 재무부는 의회에 보고한 '주요 교역 대상국의 거시경제 및 환율 정책' 반기 보고서에서 중국, 일본, 한국, 싱가포르, 대만, 베트남, 독일 등 7개국을 환율 관찰대상국으로 지정했다.한국은 2016년 4월 이후 7년여 만인 2023년 11월 환율관찰 대상국에서 빠졌고, 지난 6월 보고서에서도 제외됐지만 이번에 다시 환율관찰 대상국에 포함됐다.같은 시각 원/엔 재정환율은 100엔당 898.59원에 거래되고 있다.",미국 금리 인하 속도가 느려질 것이란 전망에 14일 원/달러 환율이 다시 상승했다.
20241115,"트럼프 취임 앞두고 진퇴양난…美, 韓 환율관찰 대상국 재지정",https://n.news.naver.com/mnews/article/011/0004415452,"대미 무역흑자 150억 달러 이상대규모 경상수지 흑자도 문제돼美 ""韓 환율시장 과도하게 개입""원달러 환율이 1400원을 돌파하면서 원화 약세가 이어지고 있다. 연합뉴스‘트럼프 2기’ 행정부 출범을 앞두고 미국이 한국을 환율관찰 대상국에 재지정했다. 보편관세가 현실화할 경우 달러강세가 예상되는데, 환율관찰 대상국에 오르면 원화가치를 어느 정도 높여야 하는 부분이 있어 정부가 진퇴양난에 빠졌다. 특히 도널드 트럼프 미국 대통령 당선인은 1기 당시 중국을 환율조작국으로 지정했고 한국에 대해서도 외환시장 투명성을 높이라고 강하게 압박한 바 있어 상황이 어려운 국면으로 빠져들고 있다는 지적이 나온다.미 재무부는 14일 의회에 보고한 ‘주요 교역 대상국의 거시경제 및 환율 정책’ 반기 보고서에서 중국과 일본, 한국, 싱가포르, 대만, 베트남, 독일 등 7개국을 환율 관찰대상국으로 지정했다. 2016년 4월 이후 7년 여 만인 지난해 11월 환율관찰 대상국에서 제외됐던 한국은 이번에 다시 대상국에 올랐다.미국은 2015년 제정된 무역 촉진법에 따라 자국과의 교역 규모가 큰 상위 20개국의 거시경제와 환율 정책을 평가하고 일정 기준에 해당할 경우 심층분석국 내지 관찰대상국으로 지정하고 있다. 평가 기준은 △150억 달러 이상의 대미 무역 흑자 △국내총생산의 3% 이상에 해당하는 경상수지 흑자 △12개월 중 최소 8개월간 달러를 순매수하고 그 금액이GDP의 2% 이상인 경우다. 이 중 3가지 기준에 모두 해당하면 심층분석 대상이 되며, 2가지만 해당하면 관찰대상국이 된다.지난 보고서에서 한국은 무역 흑자 관련 기준에만 해당했는데 이번에는 경상수지 흑자도 문제가 됐다. 재무부는 2024년 6월 말 기준으로 한국의 연간 경상수지 흑자가GDP의 3.7%를 기록했다고 밝혔다. 1년 전의 0.2%에서 급증했는데 주된 이유는 한국의 기술 관련 제품에 대한 대외 수요가 견조해 상품 흑자가 증가했기 때문이다. 한국의 대미 무역 흑자는 전년도의 380억달러에서 500억달러로 늘었다. 한국 정부는 원화의 절하를 제한하려고 시장에 개입해 작년 7월부터 올해 6월까지 90억 달러를 순매도했다고 재무부는 밝혔다. 원화 절화용이라지만 한국 정부의 시장 개입 자체를 문제삼은 것이다. 재무부는 ""한국은 환율 개입을 환율 시장의 상태가 무질서한 예외적인 상황으로만 제한해야 한다""고 주문했다.",원달러 환율이 1400원을 돌파하면서 원화가치를 어느 정도 높여야 하는 부분이 있어 정부가 진퇴양난에 빠졌다.
20241117,세계 주요 통화 환율·주가지수 변동률,https://n.news.naver.com/mnews/article/001/0015051448,"17일 연합뉴스가 연합인포맥스 글로벌 환율·주가 데이터 등을 분석한 결과, 15일 현재 원/달러 환율은 1,398.80원으로, 작년 말보다 8.60% 올랐다.원·엔·위안·대만달러처럼 1달러 기준 자국 화폐 가치를 나타내는 '자국 통화 환율 표시법'을 따르는 경우, 해당 통화의 정확한 달러 대비 가치 변동률은 특정 두 시점의 환율 차이를 두 시점 가운데 최근 시점의 환율로 나눠 구한다.","17일 연합인포맥스 글로벌 환율·주가 데이터 등을 분석한 결과, 15일 현재 원/달러 환율은 1,398.80원으로, 작년 말보다 8.60% 올랐다."
