date,title,url,content,summary
20240411,"원/달러 환율, 美 CPI 충격에 급등…장 초반 1,360원대",https://n.news.naver.com/mnews/article/001/0014624838,"원/달러 환율이 11일 미국 소비자물가지수 충격을 반영해 장 초반 급등했다.이날 서울 외환시장에서 미국 달러화 대비 원화 환율은 오전 9시 19분 현재 전 거래일보다 8.7원 오른 1,363.6원에 거래되고 있다.환율은 달러 강세 영향으로 전장보다 10.1원 상승한 1,365.0원에 개장해 1,360원대 초중반에서 등락 중이다.1,365.0원은 장 중 고점 기준으로 지난 2022년 11월 10일 이후 가장 높은 수준이다.지난 10일 미 노동부 발표에 따르면 3월 미국 소비자물가지수는 전년 동월 대비 3.5% 상승했다. 2월보다 상승률이 더 높아진 데다 시장 예상도 웃돌았다.CPI상승률이 3%대 중반으로 반등하면서 6개월 만에 가장 높은 수준을 기록하자, 시장에서는 연방준비제도가 '더 늦게, 더 적게' 금리를 내릴 것이라는 전망에 힘이 실렸다.같은 시각 원/엔 재정환율은 100엔당 892.31원에 거래되고 있다.","11일 서울 외환시장에서 미국 달러화 대비 원화 환율은 오전 9시 19분 현재 전 거래일보다 8.7원 오른 1,363.6원에 거래되고 있다."
20240412,"원/달러 환율, 11.3원 오른 1,375.4원 마감…17개월 최고치",https://n.news.naver.com/mnews/article/001/0014628215,"원/달러 환율이 12일 10원 넘게 올라 17개월 만에 최고치를 기록했다.이날 서울 외환시장에서 미국 달러화 대비 원화 환율은 전일보다 11.3원 오른 1,375.4원에 거래를 마쳤다.종가 기준으로 2022년 11월 10일 이후 17개월 만에 가장 높은 수준이다.환율은 전장보다 3.6원 상승한 1,367.7원에 개장한 뒤 오후 중 오름폭을 키워 1,375.5원까지 뛰었다.달러는 이날 아시아장에서도 강세를 나타냈다.이창용 한국은행 총재는 이날 기자회견에서 최근 환율 상승에 대해 ""글로벌 달러 강세 영향""이라고 말했다.또한 ""과거와 달리 국민연금과 서학개미 등 해외투자 자산이 늘어서 환율 변동으로 경제 위기가 오는 구조가 아닌 것도 있다""고 말했다.오후 3시 30분 기준 원/엔 재정환율은 100엔당 897.63원이다. 전일 오후 3시 30분 기준가보다 6.50원 올랐다.","서울 외환시장에서 미국 달러화 대비 원화 환율은 전일보다 11.3원 오른 1,375.4원에 거래를 마쳤다."
20240413,원화 가치 이달 들어 2% 하락…주요 통화 가운데 최대,https://n.news.naver.com/mnews/article/001/0014628605,"한국은행이 12일 다시 기준금리를 3.50%로 묶고 통화 긴축 기조를 트위터 @yonhap_graphics페이스북tuney.kr/LeYN1게다가 원/달러 환율은 한국은행이 기준금리를 3.50%로 10회 연속 동결했던 전날 하루에만 0.8%가량 올랐다.블룸버그는 위험자산 기피 등에 따른 한국 증시 약세와 한국은행의 비둘기파적 입장이 전날 환율 상승의 배경이라고 해석했다.이창용 한국은행 총재는 전날 기자회견에서 과거보다 환율 상승에 따른 시장 불안이 크지 않은 이유를 묻는 말에 ""단순히 원화만 절하된 것이 아니라 글로벌 달러 강세의 영향""이라고 말했다.이어 ""과거와 달리 국민연금·서학개미 등의 해외 투자자산이 늘어 기본적으로 환율 변동으로 경제 위기가 오는 구조가 아닌 것도 있다""면서도 환율 변동성이 과도할 경우 시장 안정화 조치를 통해 환율을 안정시킬 여력이 있다고 밝혔다.다만 국민은행은 기술적으로 원/달러 환율이 1,388원에 접근할 수 있으며 오버슈팅할 경우 1,400원으로 오를 가능성도 있다고 봤다.이어 현 환율 수준도 이미 높다는 평가가 있는 만큼 1,400원을 터치하더라도 일시적일 것으로 예상했다.",원/달러 환율은 한국은행이 기준금리를 3.50%로 10회 연속 동결했던 전날 하루에만 0.8%가량 올랐다.
20240414,"1,400원대 앞둔 원/달러 환율",https://n.news.naver.com/mnews/article/001/0014629969,"원/달러 환율이 연일 연고점을 경신하며 1,400원 선도 위협하고 있다.지난 12일 원/달러 환율은 전주 대비 22.6원 상승한 1375.4원에 마감했다. 종가 기준으로 2022년 11월 10일 이후 17개월 만에 가장 높은 수준이며, 주간 상승 폭 역시 지난 1월 19일 이후 가장 컸다. 사진은 이날 서울 중구 명동거리 한 환전소에 표시된 원/달러 환율.","원/달러 환율이 연일 연고점을 경신하며 1,400원 선도 위협하고 있다."
20240414,"달러 강세에 환율↑…1,400원대 위협",https://n.news.naver.com/mnews/article/001/0014629966,"원/달러 환율이 연일 연고점을 경신하며 1,400원 선도 위협하고 있다.지난 12일 원/달러 환율은 전주 대비 22.6원 상승한 1375.4원에 마감했다. 종가 기준으로 2022년 11월 10일 이후 17개월 만에 가장 높은 수준이며, 주간 상승 폭 역시 지난 1월 19일 이후 가장 컸다. 사진은 이날 서울 중구 명동거리 한 환전소에 표시된 원/달러 환율.","원/달러 환율이 연일 연고점을 경신하며 1,400원 선도 위협하고 있다."
20240414,원/달러 환율 17개월만에 최고,https://n.news.naver.com/mnews/article/001/0014629963,"원/달러 환율이 연일 연고점을 경신하며 치솟는 가운데 14일 오전 서울 중구 명동거리 한 환전소에 원/달러 환율이 표시돼 있다.지난 12일 원/달러 환율은 전주 대비 22.6원 상승한 1375.4원에 마감했다. 종가 기준으로 2022년 11월 10일 이후 17개월 만에 가장 높은 수준이며, 주간 상승 폭 역시 지난 1월 19일 이후 가장 컸다.",원/달러 환율이 연일 연고점을 경신하며 치솟는 가운데 14일 오전 서울 중구 명동거리 한 환전소에 원/달러 환율이 표시돼 있다.
20240414,치솟는 원/달러 환율,https://n.news.naver.com/mnews/article/001/0014629961,"원/달러 환율이 연일 연고점을 경신하며 치솟는 가운데 14일 오전 서울 중구 명동거리 한 환전소에 원/달러 환율이 표시돼 있다.지난 12일 원/달러 환율은 전주 대비 22.6원 상승한 1375.4원에 마감했다. 종가 기준으로 2022년 11월 10일 이후 17개월 만에 가장 높은 수준이며, 주간 상승 폭 역시 지난 1월 19일 이후 가장 컸다.",원/달러 환율이 연일 연고점을 경신하며 치솟는 가운데 14일 오전 서울 중구 명동거리 한 환전소에 원/달러 환율이 표시돼 있다.
20240415,"원/달러 환율, 중동 긴장고조에 연고점 또 경신…1,380원대",https://n.news.naver.com/mnews/article/001/0014631935,"원/달러 환율이 중동 지정학적 리스크 고조에 15일 연고점을 재차 경신했다.이날 서울 외환시장에서 미국 달러화 대비 원화 환율은 전 거래일보다 8.6원 오른 1,384.0원에 거래를 마쳤다.이는 종가 기준으로 2022년 11월 8일 이후 17개월 만에 가장 높은 수준이다.환율은 전장보다 6.6원 오른 1,382.0원에 개장해 장 초반 한때 1,386.3원까지 고점을 높였다.이란의 이스라엘 공격으로 '중동 사태'가 악화하면서 안전자산 선호 심리에 달러화는 강세를 보이고 있다. 국제유가가 추가로 상승해 인플레이션을 재차 자극할 수 있다는 점도 달러 강세를 부추기는 요인이다.최상목 부총리 겸 기획재정부 장관은 이날 비상경제장관회의를 열어 유류세 인하 조치를 2개월 더 연장하기로 했다.유상대 한국은행 부총재도 이날 시장상황 점검 회의를 주재하고 ""금융시장 변동성이 확대될 우려가 있는 경우 시장 안정화 조치를 적기에 시행할 것""이라고 밝혔다.이날 엔/달러 환율은 153엔대 후반으로 급등하며 1990년 이후 34년 만에 최고치 수준까지 치솟았다.오후 3시 30분 기준 원/엔 재정환율은 100엔당 899.72원이다.",원/달러 환율이 중동 지정학적 리스크 고조에 15일 연고점을 재차 경신했다.
20240415,"원/달러 환율, 중동 긴장 고조에 장 초반 1,380원대로 올라",https://n.news.naver.com/mnews/article/001/0014630538,"원/달러 환율이 이란의 이스라엘 본토 공습 등의 영향으로 15일 장 초반 1,380원대로 올라섰다.이날 서울 외환시장에서 미국 달러화 대비 원화 환율은 오전 9시 10분 현재 전 거래일보다 6.3원 오른 1,381.7원에 거래되고 있다.환율은 전장보다 6.6원 오른 1,382.0원에 개장해 장 초반 1,384.0원까지 올랐다. 1,384.0원은 장 중 고점 기준으로 지난 2022년 11월 8일 이후 약 17개월 만에 가장 높은 수준이다.지난 주말 중동의 지정학적 리스크가 커지면서 안전자산 선호심리가 커졌다.국제유가가 추가로 상승해 인플레이션을 재차 자극할 수 있다는 점도 달러 강세를 부추기고 있다.이에 최상목 부총리 겸 기획재정부 장관은 이날 비상경제장관회의를 열어 유류세 인하 조치를 2개월 더 연장하기로 하면서 금융·외환시장의 과도한 변동성엔 적기에 필요한 조치를 하겠다는 입장을 거듭 강조했다.유상대 한국은행 부총재도 이날 시장상황 점검 회의를 주재하고 ""금융시장 변동성이 확대될 우려가 있는 경우 시장 안정화 조치를 적기에 시행할 것""이라고 밝혔다.같은 시각 원/엔 재정환율은 100엔당 901.16원에 거래되고 있다.","원/달러 환율이 이란의 이스라엘 본토 공습 등의 영향으로 15일 장 초반 1,380원대로 올라섰다."
20240416,원/달러 환율 장중 1400원 돌파,https://n.news.naver.com/mnews/article/001/0014634486,16일 외환시장에서 원/달러 환율이 장중 1400원을 넘어섰다. 사진은 이날 서울 중구 명동거리 한 환전소에서 거래되고 있는 환율.,16일 외환시장에서 원/달러 환율이 장중 1400원을 넘어섰다.
20240416,"원/달러 환율, 장중 1400원 돌파",https://n.news.naver.com/mnews/article/001/0014634483,16일 외환시장에서 원/달러 환율이 장중 1400원을 넘어섰다. 사진은 이날 서울 중구 명동거리 한 환전소에서 거래되고 있는 환율.,16일 외환시장에서 원/달러 환율이 장중 1400원을 넘어섰다.
20240416,원/달러 환율 고공행진,https://n.news.naver.com/mnews/article/001/0014634482,16일 외환시장에서 원/달러 환율이 장중 1400원을 넘어섰다. 사진은 이날 서울 중구 명동거리 한 환전소에서 거래되고 있는 환율.,16일 외환시장에서 원/달러 환율이 장중 1400원을 넘어섰다.
20240416,"원/달러 환율, 1400원 돌파",https://n.news.naver.com/mnews/article/001/0014634477,16일 외환시장에서 원/달러 환율이 장중 1400원을 넘어섰다. 사진은 이날 서울 중구 명동거리 한 환전소에서 거래되고 있는 환율.,16일 외환시장에서 원/달러 환율이 장중 1400원을 넘어섰다.
20240416,"원/달러 환율, 1400원 돌파",https://n.news.naver.com/mnews/article/001/0014634476,16일 외환시장에서 원/달러 환율이 장중 1400원을 넘어섰다. 사진은 이날 서울 중구 명동거리 한 환전소.,16일 외환시장에서 원/달러 환율이 장중 1400원을 넘어섰다.
20240416,원/달러 환율 1400원 돌파,https://n.news.naver.com/mnews/article/001/0014634473,16일 외환시장에서 원/달러 환율이 장중 1400원을 넘어섰다. 사진은 이날 서울 중구 명동거리 한 환전소에서 거래되고 있는 환율.,16일 외환시장에서 원/달러 환율이 장중 1400원을 넘어섰다.
20240416,"환율, 장중 1,400원 터치…구두개입에 상승폭 일부 반납",https://n.news.naver.com/mnews/article/001/0014634221,"원/달러 환율이 16일 장중 1,400원선까지 올랐다가 외환당국의 구두개입 이후 상승폭을 일부 반납하고 1,394원대에서 마감했다.이날 서울 외환시장에서 미국 달러 대비 원화 환율은 전일보다 10.5원 급등한 1,394.50원에 마감했다. 환율은 종가 기준으로 지난 5일부터 7거래일 연속 연고점을 경신했다.원/달러 환율은 전날보다 5.9원 오른 1,389.9원에 개장한 뒤 오전 한때 1,400원까지 올랐다.환율이 장중 1,400원대로 오른 것은 2022년 11월 7일 이후 약 17개월 만이다.다만, 오후 2시 55분 외환당국이 구두 개입에 나서자 1,390원대 초반까지 밀리기도 했다.기획재정부와 한국은행은 ""외환당국은 환율 움직임, 외환 수급 등에 대해 각별한 경계심을 가지고 예의주시하고 있다""며 ""지나친 외환시장 쏠림 현상은 우리 경제에 바람직하지 않다""고 밝혔다.외환당국이 구두개입에 나선 것은 2022년 9월 15일 이후 처음이다.최근 원/달러 환율은 이스라엘이 이란 공습에 '고통스러운 보복'을 할 것이란 전망이 나오는 등 지정학적 우려로 인해 위험회피 심리가 강해지며 고공행진하고 있다.여기에 미국의 3월 소비자물가지수와 소매 판매 등 미국의 물가 지표가 예상치를 웃돌면서 연방준비제도의 금리 인하 기대가 축소된 점도 달러 강세 요인으로 꼽힌다.원/엔 재정환율은 오후 3시 30분 현재 100엔당 902.34원이다.","원/달러 환율이 16일 장중 1,400원까지 올랐다가 외환당국의 구두개입 이후 상승폭을 일부 반납하고 1,394원대에서 마감했다."
20240417,"韓·日, 외환시장 첫 공동 구두개입",https://n.news.naver.com/mnews/article/015/0004974130,"양국 경제수장, 세계銀서 만나""통화가치 급락에 조치 취할 것""최상목 부총리 겸 기획재정부 장관과 스즈키 슌이치 일본 재무상이 16일 미국 워싱턴DC의 세계은행에서 만나 악수하고 있다. 기획재정부 제공한국과 일본 재무장관이 최근 원화와 엔화 가치 급락에 대해 ‘조치를 취할 수 있다’는 입장을 공동으로 내놨다. 양국 재무장관이 함께 구두개입성 발언을 한 것은 이번이 처음이다. 이창용 한국은행 총재도 외신 인터뷰를 통해 “환율 변동성이 과도하다”고 강조했다.최상목 부총리 겸 기획재정부 장관과 스즈키 슌이치 일본 재무상은 16일 미국 워싱턴DC에 있는 세계은행에서 면담하면서 “급격한 외환시장 변동성에 대응해 적절한 조치를 취할 수 있다”는 입장을 밝혔다.최근 미국의 금리 인하 시점이 늦춰질 것이란 전망이 퍼지면서 원화와 엔화는 모두 약세를 나타내고 있다. 원·달러 환율은 지난 16일 장중 달러당 1400원을 찍었고, 엔·달러 환율은 34년 만에 최고 수준인 154엔대까지 올라섰다.한국에선 최 부총리, 이 총재, 김병환 기재부 1차관 등이 구두개입성 발언을 한 데 이어 16일 오후엔 한은과 기재부가 담당 국장 공동명의로 공식 구두개입을 했다. 일본도 연일 스즈키 재무상이 시장 안정 메시지를 내고 있다. 이번에 양국 재무장관이 공동 메시지를 냄으로써 환율 안정 의지를 더욱 강하게 천명했다는 평가가 나온다.한은도 이날 이 총재의 외신 인터뷰를 통해 구두개입성 발언을 이어갔다. 이 총재는 미국CNBC방송과의 인터뷰에서 “시장 펀더멘털을 고려할 때 최근의 환율 변동성은 과도하다”고 평가했다. 고환율의 원인으로는 미국 달러화 강세와 중동의 지정학적 긴장, 일본 엔화와 중국 위안화 등 주변국 통화의 약세 등을 꼽았다. 이날 최 부총리와 스즈키 재무상은 양국의 경제 발전을 위해 협력을 강화해나가는 데도 합의했다. 17일에는 재닛 옐런 미국 재무장관까지 참석하는 한·미·일 재무장관회의가 열린다.",한국과 일본 재무장관이 최근 원화와 엔화 가치 급락에 대해 ‘조치를 취할 수 있다’는 입장을 공동으로 내놨다.
20240417,치솟는 환율에 한일 첫 공동 구두개입…외환시장 방어 총력전,https://n.news.naver.com/mnews/article/422/0000655561,"최근 달러 강세로 원화와 엔화 가치가 떨어지자 우리나라와 일본 재무장관이 처음으로 공동 구두 개입에 나섰는데요.이창용 한국은행 총재도 ""필요시 시장 안정화 조치에 나서겠다""고 재차 강조했습니다.보도에 문형민 기자입니다.연일 연고점을 갈아치우며 고공행진하고 있는 원·달러 환율, 지난 16일에는 장중 한때 1,400원을 터치했습니다.1,400원선으로 올라선 건 1년 5개월 만이자, 1997년 외환위기, 2008년 글로벌 금융위기 등에 이어 역대 네 번째입니다.일본 엔화의 상황도 마찬가지입니다.최근 엔·달러 환율은 약 34년 만에 처음으로 장중 154엔대로 떨어지기도 했습니다.미국의 금리 인하 시점이 늦춰질 것이라는 전망과 중동의 지정학적 긴장감 고조가 안전자산인 달러화의 강세로 이어진 겁니다.이 같은 대외변수들은 단기간 내에 해결되기 어려운 만큼, 비달러화의 상대적 약세가 더 이어질 것이라는 우려가 나옵니다.결국 한일 재무장관은 ""급격한 외환시장 변동에 대응해 적절한 조처를 할 수 있다""며 환율 안정에 대한 의지를 공동 표명했습니다.사실상 양국의 공동 구두개입성 발언으로, 두 나라 경제수장이 만나 외환시장에 대한 입장을 함께 표명한 것은 이번이 처음입니다.한국은행도 연일 환율 다잡기에 총력인데, 16일 기획재정부와 22개월만에 처음으로 국장 공동명의의 구두개입을 시행했습니다.이창용 한국은행 총재도 외신과의 인터뷰에서 외환당국의 직접적인 시장 개입 의사를 밝히며 환율 방어에 나섰습니다.<이창용 / 한국은행 총재> ""환율의 변동성이 지속된다면, 우리는 시장 안정화 조치에 나설 준비가 돼 있고 또 충분한 수단을 갖추고 있습니다.""외환당국의 구두 개입 수위가 높아지는 가운데, 원화 하락세가 멈출 수 있을지 시장의 관심이 커지고 있습니다.연합뉴스TV문형민입니다.",최근 달러 강세로 원화와 엔화 가치가 떨어지자 우리나라와 일본 재무장관이 처음으로 공동 구두 개입에 나섰는데요.
20240417,"원/달러 환율, 8거래일 만에 하락 마감…1,380원대 중반",https://n.news.naver.com/mnews/article/001/0014636800,"17일 원/달러 환율이 당국의 구두 개입과 위안화 강세에 힘입어 하락 마감했다.이날 서울 외환시장에서 미국 달러 대비 원화 환율은 전일보다 7.7원 내린 1,386.8원에 거래를 마쳤다.환율은 종가 기준으로 지난 5일부터 7거래일 연속 연고점을 경신했다가 이날 8거래일 만에 하락 마감했다.환율은 전날 1,400원선을 터치한 이후 외환당국이 구두개입에 나서면서 이날 4.5원 내린 1,390.0원에 개장했고, 장중 위안화 강세에 연동해 낙폭을 키웠다.민경원 우리은행 연구원은 ""위안/달러 환율이 크게 내리면서 원/달러 환율도 낙폭이 커졌다""며 ""코스피가 하락하고, 위안화를 제외한 다른 통화들은 달러 대비 약세를 보인 탓에 종가는 1,386원 수준까지 회복했다""고 설명했다.앞서 최상목 부총리 겸 기획재정부 장관과 스즈키 슌이치 일본 재무장관은 16일 미국 워싱턴D.C.에 있는 세계은행에서 면담하고 최근 원화와 엔화 통화 가치가 급락한 데 대해 심각한 우려를 공유하면서 외환시장 변동성에 적절한 조치를 취할 수 있다고 밝혔다.이창용 한국은행 총재 역시 이날CNBC방송과의 인터뷰에서 ""시장 펀더멘털을 고려할 때 최근의 변동성은 다소 과도하다""며 ""환율 변동성이 계속될 경우 우리는 시장 안정화 조치에 나설 준비가 돼 있으며, 그렇게 할 충분한 수단을 갖추고 있다""고 강조했다.같은 시간 원/엔 재정환율은 100엔당 897.18원이다.",17일 원/달러 환율이 당국의 구두개입과 위안화 강세에 힘입어 하락 마감했다.
20240418,지난해 수출대금 달러 결제 비중 줄고 원·유로 늘어,https://n.news.naver.com/mnews/article/001/0014638706,"지난해 수출과 수입 결제 대금 가운데 달러화 비중이 줄어든 대신 유로화와 원화는 늘었다.한국은행이 18일 발표한 '2023년 결제통화별 수출입' 통계에 따르면, 지난해 수출 결제 대금의 통화별 비중은 ▲ 미국 달러 83.1% ▲ 유로화 6.8% ▲ 원화 2.8% ▲ 엔화 2.3% ▲ 위안화 1.7% 등으로 집계됐다.지난 2022년과 비교하면 달러가 2.0%포인트 줄었다. 달러 결제율이 높은 반도체, 석유제품, 화공품 등을 중심으로 수출이 9.7% 감소했기 때문이다.원화는 1년 새 0.5%p 늘어 6년 만에 증가세를 보였다. 승용차, 기계류와 정밀기기 등을 중심으로 원화 결제 수출이 증가한 덕분이라는 게 한은 설명이다.문혜정 한은 국제수지팀장은 ""수출시 원화 결제 비중이 늘어나면 환전 수수료 등 거래 비용이 줄고 환율 변동성에 따른 리스크를 줄이는 측면에서 좋은 점이 있다""고 말했다.유로화 수출 비중이 확대되면서 결제 비중도 1.0%p 늘었다. 엔화와 위안화 결제 비중은 전년 대비 보합 수준이었다.수입 결제 대금의 통화별 비중은 ▲ 미국 달러 80.6% ▲ 원화 6.7% ▲ 유로화 5.8% ▲ 엔화 3.8% ▲ 위안화 2.4% 등이었다.통상 달러를 주고 수입하는 원자재를 중심으로 수입이 14.5% 감소하면서 달러 결제 비중도 전년보다 2.3%p 줄었다. 배럴당 원유 연평균 원유 도입 단가는 2022년 102.8달러에서 지난해 85.7달러로 16.7% 내렸다.반면, 위안화의 수입 결제 비중은 1년 전보다 0.7%p 늘어 역대 최대를 기록했다.",지난해 수출과 수입 결제 대금 가운데 달러화 비중이 줄어든 대신 유로화와 원화는 늘었다.
20240418,"원/달러 환율, 이틀 연속 하락 출발…1,380원 안팎",https://n.news.naver.com/mnews/article/001/0014637982,"18일 원/달러 환율이 장 초반 1,380원 부근으로 하락했다.이날 서울 외환시장에서 미국 달러화 대비 원화 환율은 오전 9시 10분 현재 전일보다 5.5원 내린 1,381.3원에 거래되고 있다.원/달러 환율은 전날 8거래일 만에 하락 마감한 데 이어 이날도 6.8원 내린 1,380.0원에 개장해 1,380원을 전후로 등락 중이다.한국과 일본 재무장관이 공동 구두 개입에 나선 데 이어 미국도 원·엔화 절하 우려에 공감을 표하면서 달러 강세가 진정되는 양상이다.최상목 부총리 겸 기획재정부 장관과 재닛 옐런 미국 재무장관, 스즈키 슌이치 일본 재무장관은 17일 미국 워싱턴D.C.에서 회의를 열고 달러 대비 원화와 엔화의 가치 하락이 지속된 데 대한 우려를 담은 공동선언문을 채택했다.이들은 ""최근 엔화와 원화의 급격한 평가절하에 대한 일본과 한국의 심각한 우려를 인지했다""며 ""우리는 기존 주요 20개국의 약속에 따라 외환시장 진전 상황에 대해 긴밀히 협의할 것""이라고 밝혔다.이창용 한국은행 총재도 같은 날 워싱턴D.C.국제통화기금 춘계 회의 계기에 열린 대담에 참석해 근래 급등 추세를 보여온 원/달러 환율의 변동성을 완화하기 위한 개입에 나설 ""재원과 수단을 보유하고 있다""고 재차 강조했다.같은 시간 원/엔 재정환율은 100엔당 894.72원이다.","18일 원/달러 환율이 장 초반 1,380원 부근으로 하락했다."
20240419,"환율, '이스라엘 공격'에 출렁…20원 급등했다 1,380원대 마감",https://n.news.naver.com/mnews/article/001/0014641716,"원/달러 환율이 19일 이스라엘의 이란 공격 소식에 급등세를 탔다가 상승 폭을 일부 반납하며 1,380원대로 마감했다.이날 서울 외환시장에서 미국 달러 대비 원화 환율은 전일보다 9.3원 오른 1,382.2원에 장을 마쳤다.원/달러 환율은 8.1원 오른 1,381.0원에 개장해 전일보다 20원 급등했지만, 오후 들어 상승세가 둔화했다.한미일 재무장관의 공동 구두개입 등으로 17∼18일 연속 하락 마감했던 원/달러 환율은 이날 미국의 금리인상 가능성이 거론되면서 사흘 만에 반등했다.특히 이날 오전 10시 40분께 이스라엘이 미사일로 이란 본토를 공격했다는 미국ABC방송의 보도 등에 따라 1,392원대로 치솟았다.그러나 이란은 이스라엘의 미사일 공격이 없었다며 폭발음은 방공망 가동했기 때문이라고 밝힌 이후 환율은 1,380원대로 밀리며 진정세를 보였다.같은 시간 원/엔 재정환율은 100엔당 895.29원이다.","원/달러 환율이 19일 이스라엘의 이란 공격 소식에 급등세를 탔다가 상승 폭을을 일부 반납하며 1,380원대로 마감했다."
