"url","username","reviewDate","year","review","rating","likes"
"https://pedia.watcha.com/ko-KR/comments/6aLMPLP4L0MOw","#RE2PECT","8년 전",2016,"액션이 없지만 긴장감은 계속 유지된다.","3.5","[]"
"https://pedia.watcha.com/ko-KR/comments/W9bEBbvVppEpZ","LoL","8년 전",2016,"복합 장르의 절묘한 조합은 언제나 사랑스럽다.","4.0","[]"
"https://pedia.watcha.com/ko-KR/comments/3kNEppe4kdEOg","신재경","8년 전",2016,"섬세하고 정적인 복수극 겉치레 없이 깔끔하다","4.0","[]"
"https://pedia.watcha.com/ko-KR/comments/6PzQ40gaWlQqV","뭉치(계정주)","8년 전",2016,"너무 트릭에 집착한 것이 아닐까 하는 일말의 아쉬움.","3.0","[]"
"https://pedia.watcha.com/ko-KR/comments/y4ZMOlmjBXQOp","신현경","8년 전",2016,"나치 전범에 대한 새로운 접근. 화를 내야할지 공감을 해 주어야할지 갈피를 못잡겠다.","3.5","[]"
"https://pedia.watcha.com/ko-KR/comments/xplMdXmLApM4o","조용중","8년 전",2016,"역사(노인)는 기억하고 인간은 망각(치매)한다.","3.5","[]"
"https://pedia.watcha.com/ko-KR/comments/6GWQ1g7av2J50","Rstone","8년 전",2016,"기억하라.","4.0","[]"
"https://pedia.watcha.com/ko-KR/comments/xkPEmkz3XMK3W","홍준","8년 전",2016,"그러게...남자의 복수는 70년도 결코 긴 세월이아니지...  한 남자의 치밀한 복수극..이렇게 느리지만 긴장감 가득한 영화도 있을까... 영화보는 내내 행복했던 시간..","3.5","[]"
"https://pedia.watcha.com/ko-KR/comments/ZGYMGOwmDMr8K","........","8년 전",2016,"어느 정도 예상되는 결말이지만 담긴 의미는 예상하지 못 했다","3.0","[]"
"https://pedia.watcha.com/ko-KR/comments/lP0E8GR4ZQbxg","사이프러스","8년 전",2016,"폰트랩대령이라니. 아직까지 현역이시었네    폰트랩대령에게도 , 신분을 감추고 숨어살던 아우슈비츠 구역장에게도  삶은 동일하게 계속되어진다.","3.5","[]"
"https://pedia.watcha.com/ko-KR/comments/xzaQAoVBk2g5L","영화펭귄","8년 전",2016,"포스터만 보고 크나큰 액션인줄 알고 보다 농후한 움직임에 빠져들기 시작해 결국 수증기와 같이 증발했다.","4.0","[]"
"https://pedia.watcha.com/ko-KR/comments/j7kQz7oJzEl4J","미레일","8년 전",2016,"서사적 재미는 있지만 메시지를 담기에는 부족했다","2.5","[]"
"https://pedia.watcha.com/ko-KR/comments/3kNEpvrxyMOgK","AIfredo","8년 전",2016,"기억을 찾고나니 몰려오는 진실의 무게.","4.0","[]"
"https://pedia.watcha.com/ko-KR/comments/7JVEov3VZQ9yo","운몽","9년 전",2015,"홀로코스트에 대한 영화는 끝도 없이 나오는구나. 정통역사극,휴먼코미디에서 액션, 치매노인의 복수극까지...우리도 그랬으면 좋겠다. 위안부,독립투쟁,민주화운동..소재는   세계 어느나라보다 다양한데.","3.5","[]"
"https://pedia.watcha.com/ko-KR/comments/6GWQ13a0l2J50","버이후드","9년 전",2015,"몰입도 최고 !! 총알이 발사되는 순간!!! 더 흥미진진 이렇게 좋은 영화를 몰랐다니...! 강추!!","4.5","[]"
"https://pedia.watcha.com/ko-KR/comments/P7kEWY8OBMJ9r","박상은","9년 전",2015,"그가 기억해내야 하는 것과 우리들이 기억하고 있어야하는 것. 처음에는 할아버지의 복수를 다룬 그저 그런 영화라고 생각했다. 근데 웬걸 영화를 보면서 허를 찔린 기분이다. 할아버지의 모든 행동에 몰입하지 않을 수 없었다.","4.0","[]"
"https://pedia.watcha.com/ko-KR/comments/xplMdvxLYE4oL","림군이","9년 전",2015,"자신을 기억하자 찾아온 비극","3.5","[]"
"https://pedia.watcha.com/ko-KR/comments/GO6MZGkYDQNxa","rom","9년 전",2015,"오토 발리쉬","4.0","[]"
"https://pedia.watcha.com/ko-KR/comments/PkvE68ggnMpgG","김남훈","9년 전",2015,"귀향과 굉장히 비교되는 짜임새있는 전개 세련된 결말 아픈역사에 대한 잔잔한 복수","3.0","[]"
"https://pedia.watcha.com/ko-KR/comments/boPQj0zPn2KLg","Eomky","9년 전",2015,"끝내 정의가 된 왜곡된 기억?","3.5","[]"
"https://pedia.watcha.com/ko-KR/comments/NXnE5GA0rMzGP","월터 핑크맨","9년 전",2015,"결말의 반전을 어느 순간 예측 할 수 있었지만 크게 중요하지는 않다.  결말부가 tv 단막극스럽긴 하지만 깔끔하다.","3.5","[]"
"https://pedia.watcha.com/ko-KR/comments/W4zQr75n9Ew1g","진입금지","9년 전",2015,"명작","5.0","[]"
"https://pedia.watcha.com/ko-KR/comments/rdVMNkeJPQqlp","mj kim","9년 전",2015,"잊을수 없는 기억, 잊고 싶었던 기억..","3.5","[]"
"https://pedia.watcha.com/ko-KR/comments/W4zQr7kYbEw1g","이윤석","9년 전",2015,"치매에 걸린 유대인 할아버지가 친구의 편지를 가이드 삼아 아우슈비츠에서 자기 가족을 죽인 나치 전범을 찾아 복수의 길을 떠난다... 그 끝에는 엄청난 반전이 기다리고 있는데 여러가지 생각을 하게 만드는 완벽한 복수극~!!","4.0","[]"
"https://pedia.watcha.com/ko-KR/comments/mkPMn4y7BEwqz","제니제니","9년 전",2015,"역사를 기록할 방법과 매체는 더욱 다양해졌지만 여전히 사람들은 '잊고' 산다.","3.5","[]"
"https://pedia.watcha.com/ko-KR/comments/droQ014q7EyNJ","김민영","9년 전",2015,"아우슈비츠를 끝까지 잊지 않고 기억하는 이들을 보며 우리네 위안부 할머니들은 누가 기억해 줄 것인지가 아프게 다가왔다.","4.0","[]"
"https://pedia.watcha.com/ko-KR/comments/8n92V5pYnEAJ6","JS","9년 전",2015,"잊었던 기억마저 기억하게 해주는... 몇십년을 기다린 복수극...슬프다..","4.0","[]"
"https://pedia.watcha.com/ko-KR/comments/nd3M3o1waMNgV","dohcjhw","9년 전",2015,"이 영화의 묘미도 마지막 반전일텐데, 보면서 예상이 되버려서 좀 김이 빠지는 느낌이 있다. 몇십년전의 과거의 역사도 바로 잡으려는 시도와 작품들을 볼때면, 그들과 비교되는 한국의 현실이 안타깝다.","2.5","[]"