"url","username","reviewDate","year","review","rating","likes"
"https://pedia.watcha.com/ko-KR/comments/3WB2qe6L6G2pj","죠블리","6년 전",2018,"거짓된 삶은 사는게 아니다.","4.0","63"
"https://pedia.watcha.com/ko-KR/comments/boY2leAz6MWOJ","영화.다큐.OTT.책.많이보고읽자","9년 전",2015,"그 잔인하고도 슬픈역사에..대한 한노인의 완벽한 계획과 복수!!","4.0","13"
"https://pedia.watcha.com/ko-KR/comments/P7kEWNzb5pQJ9","이진구","8년 전",2016,"잽과 가드로만 일관함에도 팽팽한 긴장감을 연출하던 링 위의 선수가 마지막에 날리는 스트레이트 한 방","4.5","12"
"https://pedia.watcha.com/ko-KR/comments/NXnE5PqY4BQzG","이단헌트","1년 전",2023,"복수는 기억하는 사람의 고통과 몫","4.0","10"
"https://pedia.watcha.com/ko-KR/comments/xzaQAmle4lQg5","Keep","2년 전",2022,"빌어먹을 '그땐 그랬지' 그게 부당한 꼬락서니라면 인정하고 반성을 해야죠  '그땐 다 그랬다'고 정당화시켜선 안되는 겁니다  그들은 저를 괴롭히는 대신 제게 그 이유부터 물었어야 합니다  from. 지독한 후풀푸프, 세베루스 스네이프","4.0","7"
"https://pedia.watcha.com/ko-KR/comments/ZGYMGRD5o2r8K","뿜뿜","9년 전",2015,"내용이 탄탄하다. 90세 가까이 되는 노인이 주인공인데 스릴이 느껴진다. 마지막 결말이 압권!","4.0","7"
"https://pedia.watcha.com/ko-KR/comments/lP0E8dZGwEbxg","박지훈","9년 전",2015,"차분한 전개... 끝까지 봐야 끝을 아는 영화.","4.0","5"
"https://pedia.watcha.com/ko-KR/comments/bW3Qk4r0o0E9p","이용희","2년 전",2022,"이이제이.  사유의 깊이와 연출의 퀄리티가 리메이크작(리멤버)과는 비교도 되지 않게 훌륭하다. 피해자의 진실된 고통, 반성을 모르는 후손, 전범자에 대한 처단, 그리고 이 모든 것들을 아우르는 완벽한 결말까지, 전쟁 범죄는 이렇게 다뤄야 한다. 이 원작을 먼저 보지 못한 것이 아쉬울 따름이다.","4.0","4"
"https://pedia.watcha.com/ko-KR/comments/GO6MZXNKgbENx","Soodaler","7년 전",2017,"반전은 예상했지만, 이 정도면 기발한 복수의 방법 중 하나가 아닐까 생각한다.","3.5","4"
"https://pedia.watcha.com/ko-KR/comments/rdVMND8wPEqlp","Hama","8년 전",2016,"차분하고 잔잔한 분위기가  영화의 장점이자 단점.","3.0","4"
"https://pedia.watcha.com/ko-KR/comments/PkvE6Kro42pgG","무비곰","9년 전",2015,"순간순간마다 느껴지는 긴장감. 의외의 발견.","3.5","4"
"https://pedia.watcha.com/ko-KR/comments/W9bEBPJXvjMpZ","JazZ","5년 전",2019,"대부분 복수를 주제로 다루는 작품들이 사이다를 터트려 주느냐 아니냐에 따라 팬심이 움직이는 건 당연하다 헌데 특히 노인들이 힘든 몸을 이끌고  복수를 하나하나 해 나갈때 그 증폭게이지는 엄청나다, 이유는 젊은주인공이  복수를 하면 당연하다 판단하고 즐겁게 보고  끝나겠지만 노인은 다르다, 관람객도  같이 온몸에 힘과 에너지가 들어가도록  최면에 걸리기 때문에... 그래서 더 시원하고  당연시 되어진다 이 작품 말고도 '해리 브라운' 이란 작품을  내가 몹시 좋아하는 이유다","4.5","3"
"https://pedia.watcha.com/ko-KR/comments/7JVEoGpoZE9yo","Actinium","8년 전",2016,"난망 [難忘] 잊기 어려움. 돈망 [頓忘] 까맣게 잊어버림. 불망 [不忘] 잊지 아니함.","4.5","3"
"https://pedia.watcha.com/ko-KR/comments/6GWQ1g6Al2J50","개구진개굴이","8년 전",2016,"이 영화의 줄거리를 말로하면 웃긴데 막상 영화를 보면 전혀 웃기지 않음. 인과응보의 의미를 90세에 몸소 실천하는 대단한 할아버지들","4.0","3"
"https://pedia.watcha.com/ko-KR/comments/W9bEBnawKEpZ7","정영훈","9년 전",2015,"완벽한 복수와 회개. 전쟁의 아픔.","4.0","3"
"https://pedia.watcha.com/ko-KR/comments/1Vl2bm0mnErRn","Hyuna Jang","9년 전",2015,"독하디 독한 죄는 독하게","4.0","3"
"https://pedia.watcha.com/ko-KR/comments/NXnE5xAgyQzGP","Kyuzinz","9년 전",2015,"노년의 배우들이 펼치는 완전한 복수극...","3.0","3"
"https://pedia.watcha.com/ko-KR/comments/y4ZMOmv8OOEOp","Jeong Joon Kim","6개월 전",2024,"예상이 그대로 되서...행크 아저씨의 연기만 인상적","3.0","2"
"https://pedia.watcha.com/ko-KR/comments/OAxM70pGPpQbm","summer","1년 전",2023,"쓰라린 반전","5.0","2"
"https://pedia.watcha.com/ko-KR/comments/boPQjbzx4nQKL","영화라는 종합예술","2년 전",2022,"역사의 무게감을 체험하는 핏빛 응징.","3.5","2"
"https://pedia.watcha.com/ko-KR/comments/zD82XAnLJBM53","신경민","7년 전",2017,"힘이 무시무시하다~ 묵직한 진실 허술한건 거듭되는 분열에 지친 텔로미어 뿐이다.","3.5","2"
"https://pedia.watcha.com/ko-KR/comments/W4zQrdDkVb2w1","이원모","7년 전",2017,"Now, I remember.","4.5","2"
"https://pedia.watcha.com/ko-KR/comments/8n92Va8AgnEAJ","최주영🌈","8년 전",2016,"이 영화는 느리다. 관객들에게 믿음을 주기 위한 스포이드 한방울씩의 최면이다.","3.0","2"
"https://pedia.watcha.com/ko-KR/comments/BglQakPZL2X0m","조성호","8년 전",2016,"아우슈비츠와 나치 이야기를 장르적으로 풀어내다니! 아톰 에고이얀의 솜씨가 빛을 발한다. 마지막 반전도 탁월","3.5","2"
"https://pedia.watcha.com/ko-KR/comments/GO6MZvnWgMNxa","송원섭","9년 전",2015,"지금의 이스라엘이 하는짓이 나중에 이런 영화로 다시 나올꺼다","4.5","2"
"https://pedia.watcha.com/ko-KR/comments/7JVEonaOKQ9yo","5ivePM","9년 전",2015,""" I REMEMBER "" 주인공의 흔들리는 눈빛. 길고 어두운 터널을 빠져 나오니 발 밑은 낭떠러지. 잊었든 잃었든. 기억은 기억이다...","4.0","2"
"https://pedia.watcha.com/ko-KR/comments/GO6MZGnw0QNxa","세르지오","9년 전",2015,"예상된 반전이었으나, 차분하면서 몰입감 가지고 잘 볼 수있었던 영화.","3.5","2"
"https://pedia.watcha.com/ko-KR/comments/6aLMPeGlgQOwb","Jung Jin  Yun","9년 전",2015,"느린 가운데 찾아오는 긴장감은 정말 숨이 멎을 듯한 느낌을 준다 요즘 처럼 화려한 스릴러는 아니지만 그렇기에 더욱 가치 있다 이 이상 완벽한 결말이 있을까","4.5","2"
"https://pedia.watcha.com/ko-KR/comments/W9bEBzV4O7EpZ","학의나래","5개월 전",2024,"점점 치닫고 있는 극단의 시대,,, 시작은 공통의 기억에서 부터이다....  아직 이 시대 존재하고 있는 전체주의자 군국주의자들에게....","3.5","1"
"https://pedia.watcha.com/ko-KR/comments/3WB2qnK4mjMpj","싱요미","2년 전",2022,"90세에 가까운 노인을 주인공으로 내세워 이렇다할 액션 장면 없이도 이끌어낸 서스펜스와 스릴감","4.0","1"
"https://pedia.watcha.com/ko-KR/comments/j7kQzmBaOGMl4","록록","5년 전",2019,"엔딩을 위한 긴장감.","3.0","1"
"https://pedia.watcha.com/ko-KR/comments/j7kQzoqqqNEl4","Vonchio","6년 전",2018,"알츠하이머를 이용한 뒷통수치기.  노인의 노인에 의한 노인을 위한 복수!!!","3.5","1"
"https://pedia.watcha.com/ko-KR/comments/nd3M3dXLWBQNg","Ray Park","7년 전",2017,"잔잔하지만 ....마지막에 던지는 감독의 반전 !!","4.5","1"
"https://pedia.watcha.com/ko-KR/comments/6PzQ40zWvnQqV","한위서","7년 전",2017,"타인을 겨눈 총구가 자신을 향할 때, 발사될 총알보다 더 무서운 건 총을 든 자신의 모습을 대면하는 것","4.0","1"
"https://pedia.watcha.com/ko-KR/comments/xzaQAeL4ApQg5","윤태영","7년 전",2017,"살인자의 기억법","2.5","1"
"https://pedia.watcha.com/ko-KR/comments/droQ00WJmPQyN","mf","8년 전",2016,"반성보다 기억하지 않은 죗값.","3.5","1"
"https://pedia.watcha.com/ko-KR/comments/droQ0049XKQyN","고씨","8년 전",2016,"와 와...이거 나름  꽤, 와...90세 가까이 되는 알츠하이머 노인으로 이정도 스토리를 갖춘 스릴러라니","4.0","1"
"https://pedia.watcha.com/ko-KR/comments/ZGYMGZZqe52r8","Ardenne","8년 전",2016,"치밀한 복수, 처절한 카타르시스","4.5","1"
"https://pedia.watcha.com/ko-KR/comments/wlL2DGO0mEyZ0","최인혁","8년 전",2016,"반전이라는 역하게 가벼운 단어따위로 표현될 영화가 아니다.","5.0","1"
"https://pedia.watcha.com/ko-KR/comments/gwVQx1xalEB0r","실존주의자","8년 전",2016,"침묵의 고요속에서 갑자기 휘몰아치는 충격과 반전의 영화. 아무 기대도 안하고 봤다가 뒤통수 맞으면서 엔딩크레딧 올라갈때까지 멍때리고 있었다.","4.0","1"
"https://pedia.watcha.com/ko-KR/comments/wlL2DkZeVEyZ0","유지환","8년 전",2016,"느껴본 적 없는 느긋하고 묵직한 긴장감.","3.5","1"
"https://pedia.watcha.com/ko-KR/comments/Vw8MLvgWYEelX","레이천복","8년 전",2016,"영화 좋았어요. 우리 할아버지 오래오래 사세요.","4.0","1"
"https://pedia.watcha.com/ko-KR/comments/ZGYMGbLJ02r8K","강승민","8년 전",2016,"나치즘에 관하여 함부로 지껄이지 말라는 걸 몸소 보여주는 오토 발니쉬의 여행","5.0","1"
"https://pedia.watcha.com/ko-KR/comments/Vw8MLaN6rQelX","김동훈","9년 전",2015,"이 정도로 느린데 긴장감 있는 액션영화가 있을까? 오히려 더 묵직하게 다가오는데...","3.5","1"
"https://pedia.watcha.com/ko-KR/comments/xzaQA49GNMg5L","키라키라","9년 전",2015,"아.. 결말 예상못했다.  나도.. 못잊을것같다.","3.5","1"
"https://pedia.watcha.com/ko-KR/comments/Vw8MLbPYLrEel","쿠파","16시간 전","16시간 전","예상했던 전개 그대로","3.5","[]"
"https://pedia.watcha.com/ko-KR/comments/6aLMPGWajx2Ow","김경수","2개월 전",2024,"치매 걸린 할아버지 킬러의 심리를 그대로 따라가며 전개되는 '약자의 정치학'과 그에 농락당한 관객들의 뒤통수를 한방에 날려버리는 '역사'라는 거대한 복수.","3.5","[]"
"https://pedia.watcha.com/ko-KR/comments/Vw8MLbmPyrEel","눅눅","3개월 전",2024,"나(치)를 찾아줘.","3.5","[]"
"https://pedia.watcha.com/ko-KR/comments/W4zQrxPr9O2w1","zerom","8개월 전",2024,"2024년 03월 01일  REMEMBER","3.5","[]"
"https://pedia.watcha.com/ko-KR/comments/Vw8MLbbjxDEel","콘스탄티노플","9개월 전",2024,"지금 보이는 것, 아는 것이 다 진실은 아니다.","3.5","[]"
"https://pedia.watcha.com/ko-KR/comments/boPQjbv4A6QKL","조조는나의힘","1년 전",2023,"한국 리메이크 영화보다 설득력있다.","4.0","[]"
"https://pedia.watcha.com/ko-KR/comments/nd3M3Bo0NP2Ng","keorm","1년 전",2023,"되돌아 온 기억의 칼날.  # 오토 발리쉬, 쿠니벨트 슈톰 ========== 리멤버: 기억의 살인자는 독일에서 제작된 아톰 에고이안 감독의 2015년 드라마, 스릴러, 미스터리 영화이다. 크리스토퍼 플러머 등이 주연으로 출연하였다. -------------------------- 유명한 유대인 정치철학자 한나 아렌트(1906-1975)는 예루살렘에서 열렸던 나치 전범 아돌프 아이히만의 재판에 기자 자격으로 참가했다. 그리고 1960년에 재판과정을 자세하게 그린 『예루살렘의 아이히만』이라는 책을 펴냈는데 이 책을 통해 ‘악의 보편성’이라는 개념을 성립시켰다. 인간은 보통 자신이 저지른 범죄와 자신의 책임성을 연결시키지 못한다는 뜻에서 나온 개념이다. 이렇게 글을 시작하는 이유는 이제 소개하려는 영화 ‘리멤버: 기억의 살인자’(감독 아톰 에고이안)에서 바로 악의 보편성 문제를 발견했기 때문이다.  루디 쿨란더! 이는 누구도 주목하지 않은 정도로 독일에서 흔한 이름이다. 그러나 ‘리멤버’에서는 이야기를 풀어나가는 열쇠가 되는 이름이기도 하다. 2차 대전이 끝나갈 무렵 아우슈비츠 수용소에서 유대인 처형을 담당했던 구역장 한 사람이 목숨을 부지하려 유대인으로 위장했고 이름까지 루디 쿨란더로 바꿔 미국으로 건너와 남은 평생을 살았다. 평생 나치 전범을 추적해 전범 재판에 넘기는 일을 했던 맥스 로젠바움(마틴 랜도)은 루디 쿨란더가 위장한 아우슈비츠 구역장이라는 사실을 알아냈지만 결국 정확히 누구인지 밝혀내진 못했다. 그리고 세월이 흐르고 흘러 거의 70년이 지났고 이제는 실버타운에서 코에 산소 줄을 낀 채 살아가는 신세다. 그러다가 우연히 아우슈비츠에 같이 있었던 제프 구트만(크리스토퍼 플러머)을 만나 그에게 임무를 맡긴다. 2차 대전 직후에 미국으로 건너온 네 명의 루디 쿨란더를 차례로 만나 그 중의 한 명이 악독한 살인자라는 사실을 확인하면 총으로 쏴 죽이라는 것이었다. 맥스나 제프나 루디나 이미 90을 바라보는 노인들이니 전범 재판에 넘겨 시간을 끄느니 즉결 처형을 하라는 뜻이었다. 다행이 제프 역시 루디를 기억하고 있기에 임무를 맡긴 것이었다.  영화의 주인공 제프는 불과 며칠 전에 아내 루스가 죽었고 딸과 아들이 가끔씩 실버타운에 찾아와 아버지를 돌보고 있다. 그런데 이미 치매가 시작돼 아침에 눈을 뜨면 자신이 누구인지 뿐 아니라 어디에 있는지 도통 모른다. 그나마 아직 약간의 정신이 있을 때 루디를 처단하지 못하면 맥스와 제프의 한은 풀어질 수 없는 노릇이었다. 이제 제프는 맥스의 편지를 몸에 지닌 채 아무도 모르게 실버타운을 나선다. 복수심에 불타서! 그리고 손목에는 ‘편지를 읽어라’라는 말을 써놓았다. 자신의 하루를 치매로 헛되이 날리지 않기 위해...영화를 매우 재미있게 보았다. 특히 네 명의 루디 쿨란더를 찾아갈 때마다 나치의 잔혹성이 하나하나 밝혀지는 과정이 주목할 만했다. 감독이 세심한 주의를 기울이며 이야기를 구성했다는 인상을 받았다. 루디 쿨란더 1(브루노 간츠)은 사막의 여우 롬멜 장군 휘하에서 군복무를 했던 사실을 지금도 자랑스럽게 여기고, 루디 쿨란더 2(하인츠 리벤)는 아우슈비츠에 있었던 것은 사실이지만 동성애자로 수용됐던 독일인이며, 3개월 전에 죽은 루디 쿨란더 3은 나치 소년대원(히틀러 유겐트)으로 유대인 체포에 앞장섰던 자이다. 생전의 그에겐 나치 제 3제국이 여전히 이상적인 나라였고 그의 잘못된 교육은 자식 존(딘 노리스)의 인생마저 망쳐버렸다. 집에 자랑스럽게 걸린 하켄 크로이츠(꺾인 십자가) 국기만 보아도 알 수 있다. 세 명의 루디 쿨란더는 용맹했던 독일 병사거나 수모를 받았던 독일인이거나 한 치의 변화도 없이 여전히 나치로 살아가는 소년 독일병이었다. 하지만 아직 아우슈비츠의 살인자는 본색을 드러내지 않았다. 이제 남은 한 사람, 루디 쿨란더 4(유르겐 프로크노)만 찾으면 모든 게 밝혀질 터이다. 관객은 제프가 노크를 하고 루디의 딸이 문을 여는 장면부터 더욱 긴장하시길 바란다. 극적인 반전이 시작되려는 참이다.  제프는 피아노를 정식으로 배운 사람이다. 하지만 아우슈비츠 이후 피아노 연주를 멈췄다. 그는 루디 쿨란더 4의 집에서 바그너를 연주한다. 제프는 독일어를 알아듣지만 일부러 사용하지 않는다. 그를 괴롭혔던 독일인들이 쓰는 언어를 입에조차 담기 싫어서다. 그랬던 제프가 루디 쿨란더 4를 만나자 독일어를 사용한다. “비록 얼굴은 기억나지 않지만, 당신 목소리는 변하지 않았군!”  2015년 12월 28일 한국과 일본의 외무부 장관은 공동으로 ‘위안부협정’을 발표하면서 위안부 문제가 최종적이며 불가역적으로 해결됐음을 확인했다. 이런 발표를 듣고 국민들은 당연히 사전에 위안부 할머님들의 동의가 있었을 것이라 생각했는데 정작 할머니들을 쏙 빼 놓고 내린 결정이었다. 한국 정부는 위안부협정을 통해 일본에서 1억 원을 받아낸 게 획기적인 성과를 거두었다고 자화자찬까지 했다. 2015년 한일 양국이 위안부 협정을 맺은 후 어느 위안부 할머니는 말했다. “돈은 전혀 필요 없습니다. 일본으로부터 정식으로 사과만 받으면 그걸로 충분합니다.” 그 말씀을 들으면, 옥이 갇힌 전 대통령이 할머니들에게 얼마나 큰 잘못을 저질렀는지 알 수 있다.  한나 아렌트는 아마 수많은 독일인들이 살인 하지 말고, 도둑질하지 말고, 고통당하는 자에게서 이득을 취하지 말라는 성경의 가르침을 알고 있었을 것이라고 한다. 그러나 불행하게도 독일인들은 이런 양심의 소리를 개인 차원에서 해결하는 법을 배워버렸다고 단정 짓는다. ‘리멤버’에서도 양심을 버린 자들이 나온다. 그런 자들에게 영화는 충고한다. 현재의 삶이 아무리 모범적이어도, ‘거짓된 삶이란, 사는 게 아니다.’   / 박태식(영화평론가)","3.0","[]"
"https://pedia.watcha.com/ko-KR/comments/mkPMn01BYZEwq","YammY","2년 전",2022,"""우린 너무 늙었어"" 늙었어도 정산은 해야지?","3.5","[]"
"https://pedia.watcha.com/ko-KR/comments/PkvE69NWO4Qpg","Evinka","2년 전",2022,"이상한점 어차피 기억도 못 하는데 굳이 오토발리쉬라는 사람을 찾아가라고 한거","3.5","[]"
"https://pedia.watcha.com/ko-KR/comments/lP0E8mWldj2bx","세나고","2년 전",2022,"반전이 진짜 묵직하다..","4.0","[]"
"https://pedia.watcha.com/ko-KR/comments/69oMv76v36Qal","쿠아론","2년 전",2022,"복수란 이렇게 하는거다. 기대 이상의 명작.","4.0","[]"
"https://pedia.watcha.com/ko-KR/comments/lP0E8moXaG2bx","영준","2년 전",2022,"그때 정리하고 깨끗하게 시작했으면 좋았을것을...","3.0","[]"
"https://pedia.watcha.com/ko-KR/comments/6GWQ1460kqMJ5","김경수","2년 전",2022,"이성민 리멤버","보고싶어요","[]"
"https://pedia.watcha.com/ko-KR/comments/bW3Qk4eRYyE9p","Joon Choi","2년 전",2022,"Twist!","2.5","[]"
"https://pedia.watcha.com/ko-KR/comments/boY2lJRRN6QWO","황정일","2년 전",2022,"변형된 기억 용서할수 없는 죄","4.0","[]"
"https://pedia.watcha.com/ko-KR/comments/3WB2qnR1PGMpj","예매완료","2년 전",2022,"잊혀지기 전에 정리되어야 하는 것들.","3.5","[]"
"https://pedia.watcha.com/ko-KR/comments/boY2lJRadYQWO","잔인한詩","2년 전",2022,"발단, 전개, 결말이 너무 뻔해서 긴장감 제로에다가 지겨운 소재인 유태인의 아우슈비츠 이야기 치매를 이용한 복수극이다","1.5","[]"
"https://pedia.watcha.com/ko-KR/comments/69oMv7Gx0eQal","dzien dzien","2년 전",2022,"느리지만 묘하게 무겁고 묵직하다 의외의 발견","4.0","[]"
"https://pedia.watcha.com/ko-KR/comments/kpeQK8NoXyEYN","No Mad","3년 전",2021,"역사의 문제를 삶과 운명의 고리로 얽어낸, 박찬욱의 '올드보이'를 떠올리게하는 반전복수극. 우리에게도 일제강점의 역사를 보다 새롭게, 둔중하게 때리는 드라마의 출현이 몹시 필요하다. 2021.12.12.272","3.5","[]"
"https://pedia.watcha.com/ko-KR/comments/5yz2YXPxlaEWj","임현재","3년 전",2021,"???","보는 중","[]"
"https://pedia.watcha.com/ko-KR/comments/boY2lKelZdEWO","원희","4년 전",2020,"기억의 위대함을 선사하는 한 노인의 고품격 복수극","4.5","[]"
"https://pedia.watcha.com/ko-KR/comments/droQ0687qK2yN","왓챠챠","4년 전",2020,"마지막 5분을 위한 느릿한 걸음걸이","3.5","[]"
"https://pedia.watcha.com/ko-KR/comments/y4ZMOGo5k9MOp","커트머리 코베인","4년 전",2020,"두번째 씬에서 부터 이미 예상되는 반전. 할아버지의 느린 걸음만큼이나 느릿한 전개","2.5","[]"
"https://pedia.watcha.com/ko-KR/comments/OAxM79KK1pEbm","나프탈란자","4년 전",2020,"병에 대한 무지 혹은 과대평가에서 오는 개연성만 눈 감아준다면 마지막까지 긴장을 놓지않는 괜찮은 스릴러. 느린 걸음만큼이나 차근차근 쌓아서 마지막에 터뜨리는 마무리도 좋다","3.5","[]"
"https://pedia.watcha.com/ko-KR/comments/69oMvnBqRdMal","체마N보스코","5년 전",2019,"기억하다. 생각해 내다. 안부를 전하다.","3.0","[]"
"https://pedia.watcha.com/ko-KR/comments/Vw8MLrR7dVEel","Metacritic","5년 전",2019,"52","2.5","[]"
"https://pedia.watcha.com/ko-KR/comments/lP0E8J1j8PMbx","DirectorB","5년 전",2019,"어디선가 봤던 흔한 설정들과 단선적인 이야기 구조 하지만 이를 상쇄하고도 남는 노인의 진짜 얼굴","3.5","[]"
"https://pedia.watcha.com/ko-KR/comments/rdVMNljy3qEql","Jay","5년 전",2019,"한국에도 한번 만들어졌으면 하는 스토리","4.5","[]"
"https://pedia.watcha.com/ko-KR/comments/BVoM9k9XWVEP0","김동규","5년 전",2019,"오랜 세월 뒤~  우리가 저지른 수많은 원죄들이 속죄되어 퇴색되어진다면~ 우리 인간들은 동물과 뭐가 다를지..","4.5","[]"
"https://pedia.watcha.com/ko-KR/comments/lP0E8JwlqYMbx","이동영","6년 전",2018,"평균나이 80은 되는 어르신들이 만들어 내는 스릴러가 쫄깃쫄깃하다니...","4.0","[]"
"https://pedia.watcha.com/ko-KR/comments/j7kQzmYDdwMl4","정송이","6년 전",2018,"홀로코스트","3.5","[]"
"https://pedia.watcha.com/ko-KR/comments/xplMdJezJYE4o","KS","6년 전",2018,"긴장감, 반전도 있지만 느린 배우의 행동이 강도를 떨어뜨린다. 다소 뜬금없는 반전","1.0","[]"
"https://pedia.watcha.com/ko-KR/comments/BVoM9on17VEP0","조재규","6년 전",2018,"90 먹은 할아버지의 걸음거리만큼이나 느린 전개이지만 결코 지루하지 않은 전개. 누굴 찾아 가는 것인지 갈수록 궁금증을 증폭시켜 나가는데.. 그 결말은 과히 충격적이다. 와우.","4.0","[]"
"https://pedia.watcha.com/ko-KR/comments/1Vl2baRzy3ErR","강창민","6년 전",2018,"모든 것을 다 잊어도 반드시 잊지 말아야 할, 그거슨 복수!!  그리고...","4.0","[]"
"https://pedia.watcha.com/ko-KR/comments/W9bEBbyjlgEpZ","김선장","6년 전",2018,"나치 관련 영화 중 우수하지 않은 작품은 기억이 안난다. 요즘 유대인이 팔레스타인에 행하는 것처럼 반전있는 영화","4.5","[]"
"https://pedia.watcha.com/ko-KR/comments/W9bEBbyKG8EpZ","김영래","6년 전",2018,"이것이야 말로 빅픽쳐","4.5","[]"
"https://pedia.watcha.com/ko-KR/comments/NXnE5VDvxy2zG","이삭","6년 전",2018,"방아쇠를 당기지 않을수 없을만큼의 기억.","4.0","[]"
"https://pedia.watcha.com/ko-KR/comments/PkvE6m5GezQpg","어왔니","6년 전",2018,"큰그림 대박이네","4.0","[]"
"https://pedia.watcha.com/ko-KR/comments/XpeMJ1nL0o2Jn","boinda","6년 전",2018,"충격적 결말과 반전이 기다리고 있다","4.0","[]"
"https://pedia.watcha.com/ko-KR/comments/lP0E87AdqdQbx","박태우","6년 전",2018,"기억에 남을 명작 이거 안봤음 정말 꼭 보자","4.5","[]"
"https://pedia.watcha.com/ko-KR/comments/BglQaJyDqWEX0","IMDb 평점","6년 전",2018,"7.4점","4.0","[]"
"https://pedia.watcha.com/ko-KR/comments/xzaQAel3v5Qg5","Jae Jeong Kim","6년 전",2018,"때로는 기억이 망각보다 더 괴롭다. 치매노인이 주연이라고 지루할거라 함부로 짐작해서는 뒤통수 제대로 맞는다. 치밀하고 고요하게 기억을 되살리는 복수의 끝을 본다면 앞으로 '아톰 에고이안'이라는 감독의 이름을 절대로 그냥 지나치지는 못하게 될 것이다. ( 이쯤에서 생각나는 친일파의 후손들이여...반성하고 살자.. )","5.0","[]"
"https://pedia.watcha.com/ko-KR/comments/GO6MZXjLoOENx","한정수","7년 전",2017,"뭔가 다시 보고싶다","5.0","[]"
"https://pedia.watcha.com/ko-KR/comments/BVoM9oGJ3OEP0","안젤리나","7년 전",2017,"정체성을 바꾸고도 이인감 없이 생존했기에 쉽게 조종되어 자신을 찾은 여정의 종지부.","3.0","[]"
"https://pedia.watcha.com/ko-KR/comments/boY2ljBrNrQWO","그녀","7년 전",2017,"우리가 바라는 친일파 청산의 한모습","3.5","[]"
"https://pedia.watcha.com/ko-KR/comments/ZGYMGZ5YpL2r8","김규남","7년 전",2017,"어마어마한 복수에 그저 놀라울 뿐이다. . 최근 알콜성 치매끼가 보이는 나 자신이 두렵다.","4.5","[]"
"https://pedia.watcha.com/ko-KR/comments/6GWQ10p5nqMJ5","박철훈","7년 전",2017,"느릿한 전개, 완벽한 반전","3.5","[]"
"https://pedia.watcha.com/ko-KR/comments/GO6MZXbvYDENx","물에빠진물고기","7년 전",2017,"위안부 할머니들보다 열 배 이상 되었던 군인들의 증언이 일본 정부를 더 압박할 수 있다. 근데 용서를 구하는 할아버지들의 고백은 못 들어 봤다. 어찌 다같이 입을 닫았을까. 죄라고 생각해 본 적 없다해도 할아버지들의 침묵이 일본을 이롭게 하는데도 끝까지 모르는 척 할 것인가. 사과도 못 받고 다 돌아가시게 생겼다.","3.5","[]"
"https://pedia.watcha.com/ko-KR/comments/69oMvJkvn6Mal","임한얼","7년 전",2017,"긴장정도가 아니라 숨이 턱막히는 압박감. 그리고 완벽한 복수.","3.5","[]"
"https://pedia.watcha.com/ko-KR/comments/rdVMNGnZWPQql","시계태엽","8년 전",2016,"90세 노인의 느리지만 긴장되는 영화 우리는 이렇게 또 한번 나치의 만행을 '기억'한다 잠시 잊혀질뿐 없어지지 않는 진실의 기억을..","4.0","[]"
