"영화제목","작성자","작성일","평점","리뷰","공감수","비공감수"
"내일의 기억","kims****","2021.04.21. 12:09","10","김강우 흥해라ㅠㅠ 연기 진짜 잘하더라","884","187"
"내일의 기억","chun****","2021.04.21. 20:28","8","서예지는 영화속에서도 남자들 잡아먹네 영화는 볼만하다 서예지인성 스캔들만 아녔어도 150만정도는 갔을거같은데 안타깝네 손해배상청구해라 서예지한테,,","787","446"
"내일의 기억","gsqo****","2021.04.22. 20:00","10","남자배우 연기력 때문에 영화가 살아난듯ㅎㅎ","408","99"
"내일의 기억","fkss****","2021.04.21. 12:33","10","오랜만에 스릴러 영화라 넘 재밌게 봄ㅋㅋㅋ 김강우 화이팅!!!","371","155"
"내일의 기억","musy****","2021.04.21. 12:58","10","정신없이 추리하다보면 어느새 끝나있다. 놀라운 스토리와 반전이 있는 스릴러. 강추한다.","305","137"
"내일의 기억","park****","2021.04.21. 17:13","9","반전에 반전이 있는 영화~","271","136"
"내일의 기억","nmkj****","2021.04.21. 16:03","10","스릴러의 특징을 다 갖고 있는 영화였어요 스릴러 좋아하면 추천","235","130"
"내일의 기억","elli****","2021.05.15. 18:42","4","어디서 많이 본듯한 영화들을 잘이어붙인 어이없는 작품.배우 연기가 빛났다","130","36"
"내일의 기억","rout****","2021.04.24. 22:52","7","반전에 목숨 걸다 길 잃고 헤매는 여느 영화들과는 달리 끝에 가서 퍼즐을 죄다 맞춰주는 친절한 연출기법이 오히려 신선한 반전이었다는 ㅎㅎ","57","17"
"내일의 기억","heb0****","2021.05.02. 23:20","6","기대보다는 ㅠ그저구랬어용","60","22"
"내일의 기억","gksa****","2021.04.26. 00:50","10","서예지 때문에 안보려다가 감독이랑 김강우가 불쌍해서 봤는데 기대한것보다 꽤 재밌게봐서 만족....","78","45"
"내일의 기억","urnv****","2021.04.23. 18:05","8","김강우 넘 멋지당ㅠㅠㅠ","46","14"
"내일의 기억","xgiz****","2021.04.24. 11:57","10","마음 아픈 스릴러물. 넘 재밌게 봄.","51","19"
"내일의 기억","fata****","2021.04.21. 19:40","10","김강우 배우님의 눈빛과 연기는 잊을 수가 없네여ㅠㅠ 스토리도 연출도 기대이상이였고 오랜만에 재밌는 한국 영화를 본 것 같습니다","67","35"
"내일의 기억","tlub****","2021.04.25. 01:21","10","러닝타임내내 집중해서 보게 만드는 힘이 대단했던 영화.. 마지막엔 눈물 또르르...","49","18"
"내일의 기억","jc7d****","2021.04.24. 23:49","10","김강우배우 너무 멋있어요ㅠㅠ","48","18"
"내일의 기억","tnak****","2021.05.26. 09:01","6","흠.. 애매합니다. 하하","39","11"
"내일의 기억","odyb****","2021.04.23. 20:27","10","김강우 배우 너무 좋아요~~~","41","13"
"내일의 기억","ev1i****","2021.04.23. 17:31","9","김강우 배우의 연기력 때문에 끝까지 긴장하며 볼 수 있었다","42","14"
"내일의 기억","bvwu****","2021.04.22. 21:40","10","몰입감있게 잘 만들어진 스릴러물, 괜히 언론 시사회 후기가 좋았던게 아니였다 ㅋㅋ","61","34"
"내일의 기억","lk13****","2021.04.23. 12:16","10","끝까지 지루하지 않게 반전과 몰입감이 장난 아니였어요~~ 김강우님 연기 너무 좋았습니다^^","42","17"
"내일의 기억","ghib****","2021.04.23. 13:52","10","영화는 역시 스릴러ㅎㅎㅎ 처음부터 끝까지 몰입도도 높고 끝까지 재미있게 봤어요. 마지막에 모든 퍼즐 조각이 다 맞춰지는 영화였군요. 서예지 김강우 둘 다 연기도 너무 잘하고 두 분 연기합도 좋네요. 염혜란 배우도 반가웠습니다!","46","21"
"내일의 기억","znha****","2021.04.24. 14:04","10","김강우 배우님 영화라서 선택했는데 기대를 져버리지 않는...","47","22"
"내일의 기억","kitt****","2021.11.09. 11:15","10","김강우 배우가 이렇게 연기를 잘하는지 몰랐습니다. 몰입도가 장난이 아니에요. 한번보면 계속 다음내용이 궁금해서 빠져듭니다. 꼭 보시길 강추드립니다!","30","6"
"내일의 기억","sens****","2021.06.12. 18:01","10","스토리가 좋음 추천","36","12"
"내일의 기억","sink****","2021.05.18. 18:14","5","마지막 반전을 위해 달려가지만 그동안 지루하고 허점투성이라 몰입방해","49","25"
"내일의 기억","knt3****","2021.04.25. 12:54","2","미스터리를 어거지로 감동으로 둔갑시키려는 미련함","69","45"
"내일의 기억","dydr****","2021.04.25. 22:04","6","나쁘지는않지만 좋지도않죠","38","15"
"내일의 기억","dudr****","2021.04.24. 20:45","8","김강우 멋져요^^스토리도~재미있게봤어요","39","17"
"내일의 기억","kjhy****","2021.05.08. 16:53","8","믿고보는 김강우... 영화는 몰입감있고 재미있었어요!","35","14"
"내일의 기억","sang****","2021.05.20. 20:34","10","기대 이상의 스토리에요. 연기도 좋지만, 일단 반전이 있는 스토리가 너무 재밌었어요.ㅎㅎ","37","17"
"내일의 기억","uz3z****","2021.04.23. 16:35","9","중반부 부터 반전이;; 여운이 긴 영화네요...","55","35"
"내일의 기억","jnch****","2021.04.21. 14:59","10","연기 굿 스토리 굿 연출 굿","74","54"
"내일의 기억","ksjt****","2021.11.10. 23:40","8","내일의기억 연기 내용 좋았습니다 반전을 기대하세요","21","3"
"내일의 기억","noto****","2021.04.25. 10:02","10","생각보다 더 짜임새있는 영화였어요","38","21"
"내일의 기억","shyl****","2023.04.01. 04:27","9","적당한 스토리에 지루하지 않은 내용이 영화를 집중하게 해줬음. 심지어 여운까지 남았던 영화.","17","1"
"내일의 기억","hgqq****","2021.04.24. 16:09","10","모야.. 내일의 기억 재밌자나용~","36","20"
"내일의 기억","haha****","2021.05.12. 19:51","10","모를땐 똥 덜싼 기분이였는 데알고보니  소름","37","21"
"내일의 기억","bass****","2022.01.22. 21:52","8","김강우 배우, 연기 좋아요!재미있게 잘 봤어요다음 작품도 기대됩니다","19","4"
"내일의 기억","umkb****","2021.04.25. 11:37","10","오랜만에 잘만들어진 한국 스릴러","37","23"
"내일의 기억","gand****","2021.10.28. 09:31","8","스릴있고 반전","15","2"
"내일의 기억","chan****","2021.05.13. 12:27","8","계속 의심하게 만드는 스토리의 설정이 좋아요 연기도 잘 하는것 같구요","26","13"
"내일의 기억","jmib****","2021.05.10. 13:37","7","무난한 영화. 스릴러를 좋아하면 뻔하게 느껴질 수 있음.","29","18"
"내일의 기억","ksk8****","2021.04.23. 21:29","10","스릴넘치는 영화 보는내내 너무 긴장하면서 봤는데 감동까지 대박이네요 정말 재밌게 봤습니다!!","30","20"
"내일의 기억","qzjs****","2021.04.25. 14:31","8","배우들의 열연이 돋보인 영화였다","31","21"
"내일의 기억","9030****","2021.04.21. 15:15","10","영화 너무 재밌고 추리 스릴러 좋아하시는 분들에게 강추합니다 여주 논란이 안타까워요 다른 배우들 감독님 응원합니다!","95","85"
"내일의 기억","melo****","2023.02.28. 23:45","7","스토리 굿","11","2"
"내일의 기억","0hwa****","2023.03.01. 18:21","8","장르영화로서 생각보다 완성도 있다. 배우들 연기도 좋은 편.","12","3"
"내일의 기억","hmsm****","2021.06.05. 17:16","7","마지막 15분 내내 긴장감 있고 스토리 전개도 좋았습니다!","17","8"
"내일의 기억","dgmh****","2021.05.13. 17:51","10","끝까지 스릴있고 넘 재미있었어요","25","16"
"내일의 기억","jung****","2021.04.27. 22:26","10","이것은 김강우를 다시 보게 만든 영화라 할 수있다! 김강우란 배우를 다시한번 더 생각하게끔 만든영화","25","16"
"내일의 기억","popc****","2021.05.08. 13:22","10","반전의 반전이네요^^","27","18"
"내일의 기억","lsm8****","2021.05.06. 20:10","10","반전에반전에반전 작가님 천재이신 거 같아요 배우님들 연기도 최고","28","19"
"내일의 기억","gdcs****","2021.04.23. 18:40","10","내용도 연기도 모두 좋았습니다.","37","28"
"내일의 기억","karz****","2023.03.31. 10:09","10","서예지가 연기한 수지 역할이 저는 개인적으로 너무 아프게 느껴졌어요. 그래서 결말이 너무나 마음아프게 좋았습니다.","8","0"
"내일의 기억","jeh_****","2021.04.24. 23:51","10","볼만한 영화였어요 김강우배우님 연기력이 아주 굿!","22","14"
"내일의 기억","bigl****","2021.05.05. 00:25","10","배우들 연기도 좋고 스토리도 좋았습니다. 적당히 긴장하면서 재밌게 봤어요.","24","16"
"내일의 기억","dahy****","2021.04.29. 19:37","10","우와 진짜 스토리도 좋고 긴장감도 높아서 몰입해서 보느라 시간이 되게 빨리 갔어요 !!! 반전의 반전의 반전의 반전의 영화예요 마지막까지 긴장 놓치기 금지!+ 김강우 배우님 존잘","24","16"
"내일의 기억","pcso****","2021.04.23. 22:04","10","보는내내 손에 땀을 쥐게 했고.. 반전이 진짜ㅠㅠㅠ","25","17"
"내일의 기억","889k****","2021.04.22. 20:08","10","반전의 스릴러~ 너무 잘 봤어요^^","26","18"
"내일의 기억","taew****","2021.05.08. 11:32","10","스토리가 뻔하다고 생각했는데 반전이 있는 영화","27","19"
"내일의 기억","amip****","2021.04.25. 11:22","10","아무생각 없이 보다가 긴장감에 쫄았습니다스토리 구성 좋았어요","27","19"
"내일의 기억","djaw****","2021.04.25. 13:20","10","반전도 있어서 더 좋았던 듯","28","20"
"내일의 기억","vqyw****","2021.04.23. 21:54","10","오랜만에 재미있게 봤어요.집중도 최고!","28","20"
"내일의 기억","ndxp****","2021.04.23. 21:53","10","영화 자체는 참 좋습니다","32","24"
"내일의 기억","d43c****","2021.04.21. 18:30","10","믿고 보는 배우 김강우. 재밌었어요^^","45","37"
"내일의 기억","vh2i****","2021.04.22. 15:31","9","괜찮게 봤습니다 긴장감,몰입감..굿","49","41"
"내일의 기억","tere****","2021.04.25. 19:20","4","시나리오와 연출이 미스매치.    과도한 액자가 몰입을 방해함.   시간 낭비.  관람 후 기분이 몹시 나빠짐.","71","63"
"내일의 기억","love****","2021.05.01. 22:17","10","기대안하고봤는데 너무 재밌고 슬프게 봤어요~  오랜만에 넘재밌는 영화찾아 본거 같아요!","17","10"
"내일의 기억","doi8****","2021.04.27. 19:24","10","재밋어여 김강우ㅠㅠ진짜잘해여","24","17"
"내일의 기억","tzia****","2021.04.23. 15:19","9","볼만한 스릴러 영화. 흥미진진하고 친절한 반전이 좋았다.","25","18"
"내일의 기억","ve5h****","2021.04.23. 16:27","10","스릴러라는 장르답게 긴장되고 놀라고ㅋㅋㅋ 감독님의 떡밥 회수 능력에 감탄함ㅋㅋㅋ","26","19"
"내일의 기억","xkgf****","2021.04.21. 20:29","9","영화 자체는 스릴있고 재미있었다","38","31"
"내일의 기억","dhrt****","2023.02.16. 20:59","6","끝까지 지루하지않게 잘 봤지만 스토리가 조금 아쉬웠습니다","8","2"
"내일의 기억","dutl****","2022.04.28. 10:50","7","나름 괜찮았던 영화","12","6"
"내일의 기억","ebor****","2022.03.27. 12:51","10","말해 뭐합니까당장 관람하시고 이 기분을 느껴보세요","15","9"
"내일의 기억","vhzp****","2021.04.28. 13:43","8","빠져들어가면서 봤어요. 기대보다 재밌었습니다","20","14"
"내일의 기억","ghkd****","2021.04.25. 19:45","10","반전에반전 너무잼있으","25","19"
"내일의 기억","bjjh****","2021.04.26. 14:32","8","약간 뻔한 반전이었지만 그래도 재미있어요. 정말 여배우 논란만 아니면 더 흥행했을텐데 김강우 배우 흥하세요","31","25"
"내일의 기억","92o4****","2021.05.07. 14:51","10","음 볼만함 재밌음!!!","16","11"
"내일의 기억","ummw****","2021.04.25. 15:27","9","괜찮은 영화 봤네요~ 연기도 좋고 반전도 있고 감동도 있고~","17","12"
"내일의 기억","id10****","2021.04.28. 22:26","8","반전의 내용으로 약간의 긴장감도 있고보는동안 지루하지 않고 볼만했다","19","14"
"내일의 기억","ee2t****","2021.04.25. 10:29","10","반전이 좋았어요 추천요","19","14"
"내일의 기억","zqsa****","2021.04.25. 18:23","10","아주 재미있게 봤어요 반전있습니다ㅎㅎ","20","15"
"내일의 기억","kkyu****","2021.04.24. 16:41","10","재미있게 봤어요","20","15"
"내일의 기억","t21g****","2021.04.24. 13:07","10","재미있게 잘 봤습니다. 배우들 연기가 정말 좋았어요^^","20","15"
"내일의 기억","o2iw****","2021.04.23. 15:11","10","잘 짜인 스토리 마지막까지 좋았습니다 논란을 뒤로 하고 영화 자체는 정말 괜찮았다","20","15"
"내일의 기억","yebi****","2021.04.25. 15:03","10","재밌어요 큰 기대 않고봤는데 긴장감도 높고 결말도 좋았어요","21","16"
"내일의 기억","seon****","2021.04.24. 16:03","10","예고편으로는 무서울줄 알고 안보려다가 봤는데 재미있네요","21","16"
"내일의 기억","j33x****","2021.04.23. 18:04","10","반전 있는 영화라 제 취향에 딱 맞더라구요ㅎ","21","16"
"내일의 기억","elin****","2021.05.20. 19:05","10","지적인 시나리오. 인상적인 구성.","22","17"
"내일의 기억","1528****","2021.04.28. 22:51","10","배우들 연기 실감나네요.","22","17"
"내일의 기억","heta****","2021.05.03. 14:44","8","생각보다 재밌었고 배우들이 연기를 잘 했다.","23","18"
"내일의 기억","pt4u****","2021.04.23. 19:28","10","기대이상으로 재미있었어요","23","18"
"내일의 기억","kims****","2021.04.22. 21:05","10","식상하지 않고 재밌습니다!! 탄탄한 연출과 김강우 배우님의 연기 너무 좋았습니다!!","24","19"
"내일의 기억","eaai****","2021.04.22. 13:27","10","영화를 만든 모든 분들께 박수를 보냅니다. 정말 잘 관람했습니다^^","24","19"
"내일의 기억","0709****","2021.04.22. 20:47","10","반전의 반전의 반전! 맞네요^^","24","20"
"내일의 기억","tukj****","2021.05.11. 22:00","10","존잼이에여 감동백배 야옹","28","24"
"내일의 기억","hh15****","2021.04.23. 19:27","10","시간가는줄 모르고 잘봤어요 배우들 연기도 좋았고 시나리오 연출도 좋았습니다","28","24"
"내일의 기억","cwek****","2021.04.23. 18:23","10","예상외의 반전이 있네요. 잘봤습니다~","28","24"
"내일의 기억","zpqs****","2021.04.22. 15:17","9","스토리 잘짜여진 영화네요 지루하지도 않고~","29","25"
"내일의 기억","dms_****","2023.03.29. 14:54","10","기억에 대한 맹신을 사용한 기법적인 스릴러","3","0"
"내일의 기억","dosu****","2021.05.02. 19:32","10","반전의 반전이...ㅜㅜ전개가 긴장감 있어서 좋았습니다","15","12"
"내일의 기억","kimy****","2021.04.25. 15:37","10","연기는 말할 것도 없고 스토리도 연출도 다 너무 좋았어요 걱정했는데 영화는 진짜 잘나온 듯..ㅋㅋㅋ","17","14"
"내일의 기억","rkdt****","2021.05.04. 20:11","8","반전에 반전 ㅠㅜ오빠 너무 짠ㅠㅠㅠ","20","17"
"내일의 기억","pmwv****","2021.04.25. 17:45","10","배우들 연기가 좋아서 재밌었어요.","20","17"
"내일의 기억","sc2j****","2021.04.24. 13:44","10","오랜만에 보는 스릴러 영화 너무 재밌었습니다","23","20"
"내일의 기억","anoi****","2021.04.26. 00:05","8","진짜 볼꺼 없엇는데 오랜만에 영화 다운 영화 본거 같네요 군더더기 없고 배우 연기 말할것도음","25","22"
"내일의 기억","elsa****","2021.05.26. 16:44","10","진짜로 반전의 반전이에요 꼭 보시는걸 추천드려요 ??","30","27"
"내일의 기억","mxzt****","2021.04.21. 20:31","10","반전에 반전 긴장감 있고 재미게 봤어요~~","33","30"
"내일의 기억","kynj****","2021.05.03. 10:16","1","연출력과 스토리, 연기 모두 논할 필요가 없을듯..","52","49"
"내일의 기억","tnal****","2022.01.16. 18:02","8","반전이 있는 영화’ 그것때문에 재밌었다고 느껴짐","5","3"
"내일의 기억","kksp****","2021.05.01. 22:43","10","잼있습니다 많이들 보세요","13","11"
"내일의 기억","care****","2021.05.07. 17:54","7","그럭저럭  나쁘지 않음 근데 오래 남지는 않음","14","12"
"내일의 기억","ezms****","2021.04.24. 13:06","9","스토리, 배우 연기 모두 좋았습니다","16","14"
"내일의 기억","rlaa****","2021.04.27. 22:05","10","감동이고 반전놀랐아용","19","17"
"내일의 기억","pure****","2021.04.22. 23:21","8","스릴 있고 재미에 감동까지 있는 영화였어요아직 안보신 분들은스포일러 미리 접하지 않게 조심하세요","20","18"
"내일의 기억","ts6q****","2021.04.26. 15:35","10","내일의 기억 잘보고왔습니다  김강우 배우님 너무 멋있어요","21","19"
"내일의 기억","powh****","2021.04.22. 20:21","9","보는 내내 반전과 감동이 있었던 스릴러물","21","19"
"내일의 기억","bhvb****","2021.04.25. 19:12","10","보다 보면 어느새 몰입되어 추리를 하고 있는 나 자신을 발견하게 됨ㅋㅋㅋ","22","20"
"내일의 기억","pr9j****","2021.04.24. 23:21","10","몰입해서 시간가는줄 모르고 재밌게 봤네요!","22","20"
"내일의 기억","cool****","2021.04.22. 22:00","10","김강우 마지막 표정에 울음 터져서 못일어남 ㅠㅜ","22","20"
"내일의 기억","yakh****","2021.04.25. 17:08","10","이해가 잘 됐고 의아한 부분들은 나중에 풀어줘서 시원했음ㅋㅋ 마지막도 깔끔하게 끝나고 만족스러운 영화 관람이였다","24","22"
"내일의 기억","sktc****","2021.04.22. 12:22","10","보는내내 긴장감을 놓을 수 없는... 반전의 반전의 연속!","26","24"
"내일의 기억","mai6****","2021.04.23. 13:52","10","김강우씨 연기 진짜 잘하시네요 반했습니다","14","13"
"내일의 기억","barb****","2021.04.24. 23:29","10","스릴러를 좋아하는분이라면 재밌게 볼 수 있을 듯","17","16"
"내일의 기억","beep****","2021.05.02. 20:51","8","여주 이슈만 아니면 전반적으로 너무 긴장감 넘치게 잘 봤어요! 남친은 중간에 바로 눈치 챘지만 저처럼 걍 몰입해서 뭣 모르고 보는 사람들인 반전의반전으로 꿀잼인 영화!!! 김강우씨, 개인적으로 영화가 잘 안풀려서 아쉬운 배우 ㅠㅠ","19","18"
"내일의 기억","ggna****","2021.04.23. 21:58","10","기대이상ㅋㅋ연기도 좋고 스토리도 재밌음.","19","18"
"내일의 기억","erhs****","2021.04.23. 13:03","9","긴장감 대박.. 내일의 기억 재미있어요...","21","20"
"내일의 기억","jink****","2021.05.19. 00:41","8","아직 우리나라 스릴러는 그다지 ..","26","25"
"내일의 기억","bsy7****","2021.04.23. 08:08","9","서예지를 걷어내고 작품만 놓고 평가하면 꽤 괜찮았다. 긴장감 있는 연출과 마지막 반전도","26","25"
"내일의 기억","jinj****","2021.04.21. 21:14","8","영화눈 재밌움>_< 긴장감도 좋윰","27","26"
"내일의 기억","caen****","2024.07.29. 00:01","4","비추합니다. 비추합니다.","0","0"
"내일의 기억","kimh****","2023.03.11. 17:37","8","정보 없음","0","0"
"내일의 기억","hote****","2021.10.27. 17:54","7","나름볼만했던 스타일!","3","3"
"내일의 기억","evan****","2021.05.02. 20:12","6","좋아요?","7","7"
"내일의 기억","leey****","2021.04.24. 16:45","8","잘 봤어요 ~","11","11"
"내일의 기억","wech****","2021.05.04. 20:54","7","그닥 흥미로운 스토리는 아니었지만 한국스릴러의 단점인 용두사미는 아닌 영화","12","12"
"내일의 기억","ckl3****","2021.04.25. 16:36","9","영화 스토리 자체는 굿이에오ㅋ","12","12"
"내일의 기억","eee5****","2021.04.25. 11:11","9","정보 없음","12","12"
"내일의 기억","eiei****","2021.05.17. 02:26","8","흐음..나쁘지않았음","13","13"
"내일의 기억","vvv0****","2021.05.02. 19:43","10","반전이 있어서 좋았어욤 오랜만에 재밌는 스릴러 봐서 기분이 좋았음밍","13","13"
"내일의 기억","jak4****","2021.04.28. 23:17","10","스토리가 반전에 반전을 긴장감도 좋고넘 재미있읍니다.","14","14"
"내일의 기억","r5lz****","2021.04.25. 10:44","9","예측을 벗어 난 스토리.. 많이 쫄깃 쫄깃했어요","14","14"
"내일의 기억","solo****","2021.04.24. 23:12","10","진짜 보는 내내 긴장감 장난아니였습니다!!스토리도 반전의반전","14","14"
"내일의 기억","8r2d****","2021.04.25. 00:51","10","끝까지 긴장감을 유지, 반전의 반전,, ㄷㄷ","15","15"
"내일의 기억","h0fx****","2021.04.25. 00:29","10","몰입해서 시간 가는 줄 모르고 봤네요~ 기대 이상의 괜찮은 영화였습니다아","15","15"
"내일의 기억","hane****","2021.04.25. 12:09","10","기대없이 봤는데 반전도 있고 재밌게봤어요","16","16"
"내일의 기억","ytae****","2021.05.10. 09:04","10","연기 좋았고 반전 좋았어요","17","17"
"내일의 기억","nax0****","2021.04.25. 19:01","9","괜찮은 영화였어요. 심장 쫄깃쫄깃한 영화네요.","17","17"
"내일의 기억","f02i****","2021.04.23. 21:04","8","다른건 몰라도 스토리가 너무 재밌네요...","17","17"
"내일의 기억","badm****","2021.04.25. 20:12","10","반전에 반전이 있어서 좋았어요","18","18"
"내일의 기억","jan_****","2021.04.25. 16:15","10","재밌어요 유ㅏㄴ전연기 다 잘하고","18","18"
"내일의 기억","rlgu****","2021.04.24. 01:42","8","출연자들도 괜찮고 연기도 잘해고 스토리도 좋았어요 참신했어요","19","19"
"내일의 기억","pffz****","2021.04.22. 21:39","8","반전도 있고 나름 재미있게 봤다.","19","19"
"내일의 기억","gsm0****","2021.05.11. 21:26","10","반전에 반전을 거듭하는 충격과 공포 영화..","22","22"
"내일의 기억","duck****","2021.04.22. 19:49","10","스토리 탄탄하고, 배우들 연기 잘 함. 거기에 감동까지 더해서 금상첨화","22","22"
"내일의 기억","evan****","2021.05.02. 20:12","6","좋아요?","6","7"
"내일의 기억","sier****","2021.04.24. 23:13","8","정보 없음","7","8"
"내일의 기억","soye****","2021.05.16. 12:56","8","초반에 무서웠는데 ㄱㅊㄱㅊ","9","10"
"내일의 기억","yeoj****","2021.04.25. 19:14","10","정보 없음","12","13"
"내일의 기억","ojab****","2021.04.24. 15:51","10","간만에 스릴러 영화 좋았음","13","14"
"내일의 기억","aje5****","2021.05.01. 19:12","10","정보 없음","5","7"
"내일의 기억","minw****","2021.04.25. 21:32","8","반전은 좋았으나 전개와 연출이 아쉽","5","7"
"내일의 기억","vvrv****","2021.05.02. 09:54","9","정보 없음","8","10"
"내일의 기억","rpin****","2021.10.27. 00:36","4","볼 만은 한데 자꾸 생각나는 일 때문에","9","11"
"내일의 기억","pona****","2021.04.28. 11:04","8","스토리가 탄탄합니다스릴러  물 답게 반전과 미스테리가 적절히 있구요연기또한 좋습니다","10","12"
"내일의 기억","kimh****","2021.04.25. 01:00","7","생각보다 짜임새 있었다.","13","15"
"내일의 기억","gacs****","2021.04.24. 22:43","10","간만에 재밌는 한국영화ㅋㅋ 스토리가 탄탄하고 재밌다","13","15"
"내일의 기억","o_li****","2021.05.03. 17:24","8","반전 요소의 긴장감이 부족함","15","17"
"내일의 기억","nu2c****","2021.04.22. 17:43","10","영화 자체는 스릴러 영화답게 스릴감 넘치게 잘만들었네요.. 이번 이슈가 안타까울뿐....","18","20"
"내일의 기억","loeh****","2021.05.01. 18:43","8","스토리가.. 아쉽지만 나머진 다 좋아요. 특히 연기가 아주.. 최고ㅠㅠ 마지막 눈물났어요ㅠㅠ","6","9"
"내일의 기억","2002****","2021.05.02. 20:03","10","잼스요오오오오호홀호ㅗ","7","10"
"내일의 기억","dkf0****","2021.05.24. 22:18","8","사운드때메 놀라고 긴장감이 두배인듯 반전이 많아서 예상이 힘듬","10","13"
"내일의 기억","ytbx****","2021.04.25. 17:44","8","보는내내 긴장의 연속!!","10","13"
"내일의 기억","jshd****","2021.04.24. 12:34","10","배우 연기력이 돋보이는 영화입니다. 재미있게 관람하고 왔습니다:)","12","15"
"내일의 기억","song****","2021.05.07. 15:50","10","반전대박~  마지막 너무 감동했습니다","13","16"
"내일의 기억","k7g1****","2021.04.25. 19:00","9","배우들 연기 스토리가 재미있었던 영화","13","16"
"내일의 기억","kyek****","2021.04.23. 18:20","8","연기와 연출은 인정함ㅎㅎ","14","17"
"내일의 기억","xi2b****","2021.04.22. 15:51","9","의외로 좋네요 그 논란만 아니면 평점이 더 좋았을거 같은ㅎㅎㅎ","19","22"
"내일의 기억","blac****","2022.01.18. 23:27","6","엇나간 사랑","4","8"
"내일의 기억","yerv****","2021.04.25. 00:39","10","재미도 있고 긴장감도 넘치고 김강우님 연기도 훌륭했다...","11","15"
"내일의 기억","eorf****","2021.04.25. 00:19","9","뒷 이야기가 계속 궁금해지는 영화ㅋㅋ 오랜만의 스릴러 영화 잘 보았네요","11","15"
"내일의 기억","wlwp****","2021.04.24. 05:31","8","반전에 반전, 그리고 그 반전에서 보여지는 진실을 찾아가는 큰 여정","11","15"
